id,text,aspects
2111,food is tasty portion size appropriate .,"['appropriate size', 'tasty portion size', 'portion size', 'tasty size']"
2112,little crowded but move line really fast !,"['little line', 'crowded line']"
2113,enjoy ! !,[]
2114,kosher dill perfect compliment unforgetable sandwich give plenty of .,"['kosher dill', 'perfect sandwich', 'unforgetable sandwich']"
2115,kudos to po !,[]
2116,entertainment great show go on dinner .,"['great show', 'entertainment great show', 'entertainment show']"
2117,my boyfriend in ny day pastis came recommended .,"['ny day', 'my boyfriend']"
2118,food is so cheap waiter nice .,"['cheap waiter', 'nice waiter', 'so cheap waiter']"
2119,food is so good even to order wait is incredible .,[]
2120,bartender on my recent visit so incredibly rude never go back .,"['recent visit', 'my recent visit', 'rude bartender']"
2121,"sushi , kamikaze roll fresh well presented .",['kamikaze roll']
2122,"authentic thai food , look no toon .","['thai food', 'authentic food']"
2123,"it true , feel like in scene goodfellas .",['scene goodfellas']
2124,read review to say opposite experience last sunday .,['opposite experience']
2125,"highlight of night mayonaisse my side of fry received one of food runner , is not good considering bill nearly .","['food runner', 'my side']"
2126,"choose to go one of special , braised lamb shank in red wine , excellent .",['red wine']
2127,"if anyones doubt of not knowing enough wine , please check wine list .","['enough wine', 'wine list']"
2128,never !,[]
2129,"concern is slighly business waitstaff order throw food , rushing .","['waitstaff order', 'slighly business']"
2130,iced tea .,['iced tea']
2131,park avenue expected so much .,['park avenue']
2132,"small serving main entree , salmon wasnt impressed girlfriend chicken , it good .","['impressed girlfriend chicken', 'serving entree', 'main entree', 'small entree', 'girlfriend chicken', 'impressed chicken']"
2133,so rude .,[]
2134,actually get salad worth if take it home add it to lettuce !,[]
2135,ambience is romantic definitely good place to bring date .,"['good place', 'romantic definitely good place', 'romantic place']"
2136,fast .,[]
2137,"it is far popular a bar a , table waiter bartender , but we greatly enjoyed unobtrusive atmosphere .","['table bartender', 'unobtrusive atmosphere', 'waiter bartender', 'a bar']"
2138,"food is good it price , better fried dumpling ve .","['fried ve', 'better fried dumpling ve', 'dumpling ve']"
2139,much better place in ny better price .,"['much better place', 'better price', 'ny better price', 'better place']"
2140,"neighborhoody , quick sufficient .",[]
2141,obv caviar is top of line but rest of menu is so diverse it give chance to taste so manydifferent variety .,"['manydifferent variety', 'obv caviar', 'so manydifferent variety', 'so variety']"
2142,ate week ago found dish average at best expensive .,['dish average']
2143,"everything is delicious , though , my gf come week sometimes get addicted !",['my gf']
2144,could do without cigar smoke .,['cigar smoke']
2145,"still , try it , since if end up loving food , it could be one of best dining experience .","['best dining experience', 'best experience', 'dining experience']"
2146,ve waited one hour food .,"['hour food', 'one hour food']"
2147,"guest enjoyed pizza , santa fe chopped salad and fish and chip .",['santa fe']
2148,ambience is calm quiet .,[]
2149,"time extremely dissappointed by service , boarderline rude .",['boarderline rude']
2150,stay away latter since go second hint hint .,"['second hint', 'hint hint', 'second hint hint']"
2151,"not make best pizza in ny , maybe anywhere .",['best pizza']
2152,spicy tuna roll is huge probably best ve at price range .,"['price range', 'tuna roll', 'spicy roll', 'spicy tuna roll']"
2153,price quality of fish alone keep u making return visit .,"['return visit', 'price quality']"
2154,waiter of people helping attentive genuine .,[]
2155,place is bistro mean simple dish wine served efficiently in bustling atmosphere .,"['simple wine', 'simple dish wine', 'dish wine', 'bustling atmosphere']"
2156,is one of best comfort food place in city .,"['food place', 'best place', 'comfort food', 'best comfort food place']"
2157,"overall , ingredient technique am encouraged enough to return at lunch or dinner to see whether boldness of flavour palette improves .","['ingredient technique', 'flavour palette']"
2158,huge pastrami sandwich on roll .,['huge pastrami']
2159,"though undoubtedly be seated at table seems like barely enough room no matter size of party , warm atomosphere is worth cramped quarter ll fun forgot tight spot re in .","['matter size', 'tight spot', 'cramped quarter', 'enough room', 'barely enough room', 'no matter size', 'warm atomosphere']"
2160,fish not fresh rice tasted old stale .,"['fresh rice', 'not fresh rice']"
2161,"considering price of . lunch special , dish ridiculously small .",['lunch special']
2162,is pinnacle of indian fast food fast food in my opinion .,"['fast food', 'indian food', 'my opinion']"
2163,"besides , bad service , less money to tip .","['less money', 'bad service', ', bad service']"
2164,we do not need to go to four star anymore .,['four star']
2165,wine list is also really nice .,['wine list']
2166,thanked my friend recommended me certainly recommend it to others .,['my friend']
2167,plan on stopping by next week a well .,"['next week', 'a well']"
2168,"service devine , oyster sensual a come , price be beat ! !","['service devine', 'oyster sensual a come', 'sensual come']"
2169,"compared to es , tal offer less doughy bagel !","['less doughy bagel', 'doughy bagel']"
2170,ballato is consistently delicious authentic italian food .,"['delicious food', 'authentic food', 'italian food', 'delicious authentic italian food']"
2171,"service attentive , yet discreet .",['service attentive']
2172,"a retired hipster , say degree of certainty last year lucky strike best laid back late night in city .","['retired hipster', 'lucky strike', 'late night', 'last year']"
2173,price dressed up atmosphere expect get .,[]
2174,", if answer phone , re lucky if hang up on !",[]
2175,offer menu but creative drink loaded alcohol cheeky name but do cost .,"['creative drink', 'do cost', 'alcohol cheeky name', 'cheeky name']"
2176,we went to eat at jekyll hyde on friday night really enjoyed fun atmosphere good food .,"['fun atmosphere', 'jekyll hyde', 'friday night', 'good food']"
2177,food pretty tradional but it hot good large portion .,"['large portion', 'good portion', 'hot portion']"
2178,highly recommended to !,[]
2179,highly recommended .,[]
2180,"unless eating in pizzeria side of place , not in rush , place is bad idea .","['bad idea', 'pizzeria side']"
2181,to increase service lot .,['service lot']
2182,ambiance is barely romantic but management try .,['management try']
2183,"must warn reader portion size small especially appetizer , so if plan to eat full do not intend to order chef special tasting menu , prepare to order pay an appetizer dish person portion not sharing , main entree , cold udon at end of meal .","['small appetizer', 'tasting menu', 'if plan', 'entree udon', 'portion size', 'special menu', 'person portion', 'reader portion size', 'cold udon', 'small especially appetizer', 'chef special tasting menu', 'reader portion', 'dish person', 'appetizer person']"
2184,abrupt me called actually claimed food late of rice .,['abrupt me']
2185,"we got sashimi order , could not believe small portion !","['sashimi order', 'small portion']"
2186,"main course came , we see waiter at least minute !",['main course']
2187,it be on my to do list next visit to nyc .,['next visit']
2188,nothing better buying snapple . .,[]
2189,"family came in he gave apps to test palets , ordered .",['test palets']
2190,pleasantly surprised to find gem in hoboken .,[]
2191,"service is extraordinary , yet not overbearing , decor brings taste of trendy soho queen .",['trendy soho queen']
2192,"dosas skimpy , unattractive drip grease , personally drink popcorn topping eat another one of .","['unattractive drip grease', 'popcorn topping', 'unattractive grease', 'another one', 'dosas skimpy', 'drip grease']"
2193,service excellent food delicious .,"['service excellent food delicious', 'excellent food']"
2194,if wanted to deal crappy scene annoying customer go in manhattan .,"['crappy customer', 'annoying customer', 'crappy scene annoying customer']"
2195,"seafood craving , checked citysearch chose to go to fish based on previous review citysearch info .","['previous review citysearch info', 'citysearch info', 'checked citysearch', 'seafood craving', 'previous info', 'review info']"
2196,right major deegan get lady city .,"['major deegan', 'right deegan', 'right major deegan', 'lady city']"
2197,realize five minute is meaningless wait may be anywhere two to twenty minute it may be frustrating .,"['five minute', 'meaningless wait']"
2198,always fresh delicious .,['always fresh delicious']
2199,"food good , but not thai .",['not thai']
2200,"thalia is beautiful beautiful people serving , but food quite match up .","['beautiful people', 'beautiful beautiful people']"
2201,filling may be unconventional but dosa batter is definitely authentic combination tasty .,"['combination tasty', 'authentic combination tasty', 'dosa batter', 'authentic tasty']"
2202,"is perfect spot meeting friend , lunch , dinner , pre theatre or theatre drink !","['perfect friend', 'meeting friend', 'pre drink', 'perfect spot meeting friend', 'spot meeting']"
2203,is fun to go to .,[]
2204,"mussaman curry ordered a thin a water aside poorly fried tofu ordered in it , graciously provided me one piece of poorly cooked potato .","['a thin a water', 'cooked potato', 'fried tofu', 'poorly fried tofu', 'mussaman curry', 'one piece', 'poorly cooked potato', 'thin water']"
2205,late night dinner on saturday night .,"['night dinner', 'late night dinner', 'saturday night', 'late night']"
2206,try to do anything except serve great food great service in pleasant atmosphere .,"['great food great service', 'great service', 'pleasant atmosphere']"
2207,sake martini is wonderful .,['sake martini']
2208,"well , place is so ghetto not even funny .",[]
2209,bravissimo ! !,[]
2210,ran of gnochi made it me scratch !,[]
2211,we would like to thank marcelo grace wonderful dining experience ! !,"['dining experience', 'marcelo experience', 'wonderful experience']"
2212,"found service average , but could be we of u .",['service average']
2213,"arrived at orsay thrown back , in veyr good sense .","['veyr good sense', 'good sense']"
2214,"bagel ok , but be sure not to make special request !","['bagel ok', 'special request']"
2215,"is cheer of new york , whether ve ever or not .",['new york']
2216,it to die !,[]
2217,cute decorative .,[]
2218,"know is case in many nyc eatery , but , really cram in to point it borderline uncomfortable .","[', really cram', 'nyc eatery', 'many eatery', 'many nyc eatery']"
2219,fine quality .,['fine quality']
2220,overall disappointing experience price category .,"['experience price', 'price category', 'disappointing category', 'overall category']"
2221,"ve lunch buffet at chennai couple of time , in neighborhood .","['chennai couple', 'lunch buffet']"
2222,food exceptional .,[]
2223,be satisfied .,[]
2224,another great to take of towner !,[]
2225,"but , hey , is anything better decent vegetarian selection in astoria .","['better decent vegetarian selection', 'decent selection', 'vegetarian selection']"
2226,we less impressed .,[]
2227,thai of rice dinner ?,['rice dinner']
2228,but still my date bad,"['bad date', 'but still my date']"
2229,would definitely go back .,[]
2230,to rao probably time past year it keep getting better .,"['past year', 'probably time']"
2231,portion small but food so good make up .,['good portion']
2232,eaten my share impress me large amount of people to serve .,"['large amount', 'my share']"
2233,"sure , setting is nice .",[]
2234,overall worthwhile experience .,"['worthwhile experience', 'overall experience', 'overall worthwhile experience']"
2235,"service is friendly , if not prompt in world , food is great , price , not cheap , put wallet of commission .","['great , price', 'great price']"
2236,"appetizer , entree coke bill . , not including tip .","['coke bill', 'entree coke bill', 'entree coke']"
2237,"it really takeaway , sit if could take it home .",[]
2238,fun ever !,[]
2239,best drumstick over rice sour spicy soup in town !,"['spicy soup', 'sour soup', 'rice sour spicy soup', 'best drumstick']"
2240,of finest latin woman ll see in life hang at jimmy .,"['finest woman', 'latin woman', 'finest latin woman']"
2241,slightly average wine start at one selection listed at .,"['one selection', 'slightly average wine', 'average wine']"
2242,whitefish salad is excellent whitefish little mayo .,"['whitefish salad', 'little mayo']"
2243,"it come at reasonable price congee , noodle , rice dish no .","['price congee', 'rice dish', 'reasonable congee', 'reasonable price congee']"
2244,"nobody at give firm answer anything in end , not one person take responsibility anything .",['not one person']
2245,great experience .,['great experience']
2246,"chicken parm edible but canned tomato sauce boxed pasta chicken with portobello mushroom consisted of dry , inedible chicken with terrible sauce .","['pasta chicken', 'tomato sauce', 'portobello mushroom', 'canned tomato sauce', 'dry , inedible chicken', 'chicken parm', 'inedible chicken', 'terrible sauce', 'canned sauce', 'dry chicken']"
2247,recommend to everyone asks me to go good meal .,['good meal']
2248,waitress nice also get counter service sit .,"['counter service', 'counter service sit', 'nice waitress', 'service sit']"
2249,friendly staff member guy at bar .,"['friendly guy', 'staff member', 'member guy', 'friendly staff member guy']"
2250,"long time es bagel fan , surpised to find return time time to murray .","['long time', 'return time', 'time time', 'return time time', 'bagel fan']"
2251,go it !,[]
2252,highly recommended .,[]
2253,"certainly find restaurant offer superior fine experience , but superb food at reasonable price , la villa be beat .","['superior fine experience', 'reasonable price', 'fine experience', 'superb food', 'superior experience']"
2254,or is not in service directory .,['service directory']
2255,not imagine friendlier staff working in .,['friendlier staff']
2256,do suggest to ask to be seated upstairs if looking to be little cozy .,[]
2257,"to speak of park side , word not describe .",['park side']
2258,"red curry is weak tasteless , pad thai is stuck together lumpy , rice is often overcooked , seafood is pretty sketchy .","['pad thai', 'weak tasteless', 'red curry']"
2259,wine list is extensive easily hike up an otherwise reasonably priced meal .,"['wine list', 'priced meal']"
2260,"saul is pretty good , but definitely not great .",[]
2261,"would recommend roxy , but not food .",['not food']
2262,we always get sampling of appetizer share .,['appetizer share']
2263,"overall impressed return , it great qpr quality to price ratio .","['great quality', 'qpr quality', 'price ratio', 'impressed return']"
2264,"it is nearly impossible to get table , so if ever chance to go dinner , do not pas it up .",[]
2265,pad penang is delicious everything else is fantastic .,"['delicious everything', 'pad penang']"
2266,"puke green wall leave lot to be desired , but food is good .",['puke green wall']
2267,"flavor fresh pretty inobtrusive , nothing flashy .",[]
2268,"like cafe noir dont get me wrong , it is jsut people work evil incompetent ! !","['jsut people', 'cafe noir']"
2269,hanger steak like rubber tuna flavorless not to mention it tasted like it thawed .,"['hanger steak', 'rubber tuna flavorless', 'tuna flavorless', 'rubber tuna']"
2270,but small piece ? ?,"['but small piece', 'small piece']"
2271,"son love pizza we certified neapolitan pizzaria in home city seattle , we liked nearly a much difference personal preference reflection on either .","['much difference', 'personal reflection', 'love pizza', 'preference reflection', 'home city seattle', 'neapolitan pizzaria', 'city seattle', 'son pizza', 'home city']"
2272,big soft a well a good lunch food .,"['soft food', 'lunch food', 'good food']"
2273,"no food snob allowed , is people appreciate good food .","['no food snob', 'good food', 'food snob']"
2274,liked food at quasi thai .,['quasi thai']
2275,by far best salad in fast food .,['fast food']
2276,suan is great often take my friend classmate .,"['my friend classmate', 'friend classmate']"
2277,not great family or general .,"['great family', 'not great family']"
2278,"a bar , is another bad idea .","['bad idea', 'another bad idea', 'a bar']"
2279,"bagel fine , but little overcooked , not really special bagel experience .","['overcooked experience', 'special experience', 'bagel fine', 'bagel experience']"
2280,"unlike hh up block , actually give hearty hot bagel town is known .","['bagel town', 'hot bagel', 'hearty town', 'hearty hot bagel town']"
2281,thought going to jimmy would give me real domincan exprience .,"['domincan exprience', 'real domincan exprience', 'real domincan']"
2282,barebecued salmon is elegantly spiced not at dry .,['barebecued salmon']
2283,"owner a guy owns typhoon , is street on st. mark st ave .","['a guy', 'st. mark st ave']"
2284,generous portion !,['generous portion']
2285,worker also absolutely load bagel cream cheese get little messy .,['bagel cream cheese']
2286,wrong .,[]
2287,wine service good .,['wine service']
2288,"so , menu is written in chalk head it sound delicious .",['chalk head']
2289,highly spiced chai tea great .,"['spiced tea', 'chai tea']"
2290,no plan to return anytime soon .,['no plan']
2291,"many time , food is good consistent .",['many time']
2292,"seriously , is best eat in town a everyone say , spicy tuna hand roll best of , ve broken even .","['spicy tuna hand', 'spicy hand', 'tuna hand', 'a everyone']"
2293,is not single in chinatown nice neighborhood feeling like .,"['nice feeling', 'chinatown nice neighborhood feeling', 'neighborhood feeling']"
2294,"sapphire is certainly not lacking in ambiance , probably best decor of indian to in new york city , food not hoped .","['new york city', 'best decor']"
2295,would highly recommend to anyone looking casual atmosphere whisk away to left bank of river seine .,"['river seine', 'casual atmosphere']"
2296,do not understand fuss is .,[]
2297,meat dish so so .,['meat dish']
2298,"wife tanya , hostess , completes comforting atmosphere by delightfully warm gracious .","['wife tanya', 'comforting atmosphere']"
2299,"we liked it so much , we always make it point to we visit new york .",['new york']
2300,"menu consisted of standard brassiere food , better place like balthazar etc .","['standard brassiere food', 'better place', 'standard food', 'brassiere food']"
2301,"longtime fan of holy basil in east village , do believe food slightly slipped in quality , hesitant to be disloyal .","['longtime fan', 'east village', 'holy basil']"
2302,"but best part l is late night atmosphere , delightfully free of bts .","['best part', 'night atmosphere', 'late night atmosphere', 'late night', 'free atmosphere']"
2303,an untrendy rip eat .,"['untrendy rip', 'an untrendy rip']"
2304,re hungry hour later .,['hungry hour']
2305,wait to go back .,[]
2306,hate hate hate .,"['hate hate', 'hate hate hate']"
2307,we even visit manager wanted to make sure we enjoying .,[]
2308,staff is attentive to earth .,[]
2309,"go to mizu excellent service , go large amount of food , amiable atmosphere , hole in wall feeling of .","['amiable atmosphere', 'large amount', 'wall feeling', 'excellent service']"
2310,"service is always bad though , expect much of anything server , would not recommend bringing date either .",['anything server']
2311,monday night bargain at prix fix includes three course meal plus three glass of wine paired course .,"['monday night', 'night bargain', 'monday night bargain', 'course meal', 'three course meal', 'three glass', 'prix fix']"
2312,wonderful !,[]
2313,it took minute to put water in glass .,[]
2314,service is descent even small place is packed .,"['even small place', 'small place']"
2315,is best sushi in new york city hand .,"['best sushi', 'new york city hand', 'york hand', 'city hand']"
2316,go hungry enjoy .,[]
2317,eaten lot of pizza .,[]
2318,is worth an one hour drive .,['hour drive']
2319,great value quality ingredient .,"['value quality', 'great ingredient', 'great value quality ingredient', 'quality ingredient']"
2320,"thali small , thoroughly unremarkable , . .",[]
2321,sushi is also great !,[]
2322,complimentary chef app of delicate butternut squash ravioli in delicious truffle sauce to an amazing buttery and tender langostine entree to dessert remember of fabulous cakebread cabernet we drinking whole evening amazing .,"['complimentary chef app', 'delicious truffle sauce', 'amazing langostine', 'delicate butternut', 'complimentary app', 'truffle sauce', 'squash ravioli', 'fabulous cabernet', 'whole evening', 'chef app', 'fabulous cakebread cabernet', 'cakebread cabernet', 'delicious sauce']"
2323,truly mark of an attentive waiter .,"['an attentive waiter', 'attentive waiter']"
2324,"food is rather good , but if like to wait it .",[]
2325,got an excellent piece of cheesecake we several nice pastry .,"['several pastry', 'nice pastry', 'an excellent piece', 'excellent piece']"
2326,"staff is kind well trained , re fast , always prompt to jump behind bar fix drink , know detail of every item in menu make excelent recomendations .","['bar drink', 'bar fix drink', 'excelent recomendations', 'fix drink', 'every item']"
2327,makhani ok korma bland .,['makhani ok korma bland']
2328,food is inventive but still keep traditional indian flavoring .,"['indian flavoring', 'traditional indian flavoring', 'traditional flavoring']"
2329,say is wow !,[]
2330,"though service could be better possibly due to one large group in house , it is cordial warm , a is general clientele .","['large group', 'one large group', 'general clientele']"
2331,"decor in place is diner ish kind of place expect in east village not romantic , simple , small sparse .","['small sparse', 'romantic sparse', 'east village', 'diner ish', 'simple sparse']"
2332,is cute place could be good but need to get act together .,['cute place']
2333,lox is always fresh .,[]
2334,"sure enough , exactly minute later we got call seated promptly .",[]
2335,service friendly .,['friendly service']
2336,so trying to say is is by far best thai food ve ever to .,"['best food', 'thai food', 'far best thai food']"
2337,food ok fish cooked well .,"['ok fish', 'food ok fish']"
2338,we actually left hungry went across street to wo hop at mott street good chinese food .,"['chinese food', 'good food']"
2339,duck confit is always amazing foie gras terrine with fig of world .,"['amazing foie gras terrine', 'duck confit', 'amazing terrine', 'gras terrine']"
2340,"whole set up is truly unprofessional wish cafe noir would get good staff , despite current one is great .","['current one', 'good staff']"
2341,service sometimes lack focus it is not ideal if in hurry but never treated rudely .,[]
2342,staff offer impeccable service .,['impeccable service']
2343,catch is charged extra anything leave on plate so be greedy pig !,"['greedy pig', 'extra anything']"
2344,we ended great experience by gulab jamun dessert recommended by waiter .,"['great experience', 'gulab jamun dessert']"
2345,wont come back sure !,[]
2346,went to utsav yr ago my family .,[]
2347,"compare mamoun in term of price , freshness , value , consisent quality , but my opinion .","['consisent quality', 'my opinion']"
2348,"place is sleek , modern playfull return frequently .","['modern return', 'sleek return', 'playfull return']"
2349,"known secret last year , emilio godfather continued to serve food wine god at mortal price .","['last year', 'known secret', 'mortal price', 'food wine', 'food wine god']"
2350,brioche and lolly a party favor is cute and sweet touch to memorable meal .,"['cute touch', 'party favor', 'memorable meal', 'lolly a party favor', 'cute and sweet touch']"
2351,"told party of three would be seated in minute watching party multiple of higher seated minute , three of u squished small person table .","['small person', 'higher minute', 'small person table', 'person table', 'party multiple', 'seated minute', 'higher seated minute']"
2352,bill outragous .,['outragous bill']
2353,"service attentive , yet unimposing , food far better many notorious restaurant in midtown wine list is extensive well priced .","['midtown wine list', 'attentive restaurant', 'wine list', 'many restaurant', 'service attentive', 'notorious restaurant', 'midtown list']"
2354,"kind , attentive wait staff .","['kind staff', 'wait staff', 'attentive staff']"
2355,bon appettite ! !,['bon appettite']
2356,salad fantastic .,[]
2357,owner employee friendly pizza is fantastic .,"['owner employee friendly pizza', 'owner pizza', 'friendly pizza']"
2358,"la rosa waltz in , think it best .",['la rosa waltz']
2359,"food is yummy , especially cooked to perfection mussel in spicy tomato sauce shoestring crispy fry .","['crispy fry', 'tomato sauce', 'spicy fry', 'sauce fry', 'shoestring fry']"
2360,food is authentic italian delicious !,"['italian delicious', 'authentic italian delicious', 'authentic delicious']"
2361,"great addition to smith street finally , not pretentious filled woman wearing ugg boot .","['great addition', 'ugg boot', 'filled woman', 'smith street', 'pretentious woman']"
2362,skip dessert .,[]
2363,we spent in left hungry disappointed .,[]
2364,it is simply amazing .,[]
2365,complete total bagel experience by it lightly toasted .,"['complete experience', 'total experience', 'complete total bagel experience', 'bagel experience']"
2366,it like server forgot actually worked instead wanted to hang be cool .,['server forgot']
