id,text,aspects
804,get an excellent meal at of many indian restaurant on nearby lexington avenue cost of one dainty dish .,"['many restaurant', 'excellent meal', 'dainty dish', 'an excellent meal', 'indian restaurant', 'many indian restaurant', 'avenue cost', 'nearby lexington avenue cost', 'one dainty dish']"
805,"pastrami sandwich like buttah pickle an icy cold beer to wash it , it pleasurable experience .","['pastrami sandwich', 'cold beer', 'an icy cold beer', 'icy beer', 'pleasurable experience']"
806,plain pizza soggy creative wild mushroom third generation fornini pizza we drenched truffle oil in middle making it soggy nothingon rest .,"['wild mushroom', 'creative pizza', 'third generation', 'plain pizza', 'truffle oil', 'nothingon rest', 'fornini pizza']"
807,"late nite omelletes not good , is no variety !","['no variety', 'good omelletes', 'late nite omelletes', 'nite omelletes']"
808,everything at sala thai is tasty well portioned .,['sala thai']
809,", complained to me small tip .",['small tip']
810,it great to pick up cheap lunch or dinner .,['cheap lunch']
811,"behind counter , two men squeezed in .",['two men']
812,great find ! !,['great find']
813,"if delivered , make mint !",[]
814,"whenever need sushi fix , mizu be quality fish great service .","['sushi fix', 'quality fish', 'great service', 'quality fish great service']"
815,"waitress sweet accomodating , not overbearing .",[]
816,went my wife we to wait table even though could see many empty not reservation sigh on .,"['reservation sigh', 'many sigh', 'my wife', 'empty sigh']"
817,really disappointed ant wanted to tell everyone not to go eat or even take food .,"['really disappointed ant', 'disappointed ant']"
818,website rating make place look wonderful but in reality it disappointing .,['website rating']
819,"despite slightly limited menu , everything prepared is done to perfection , ultra fresh work of food art .","['fresh work', 'limited menu', 'slightly limited menu', ', ultra fresh work', 'food art', 'ultra work']"
820,outdoor atmosphere of sitting on sidewalk watching world go by foot away on th avenue on cool evening wonderful .,"['outdoor atmosphere', 'watching world', 'cool evening']"
821,"large is , topping .",[]
822,"in event , is ll be sure to stop by in part of town .",[]
823,definitely go back .,[]
824,it is not worth buck .,['worth buck']
825,brick oven gallery is my pick best pizza anywhere .,"['oven gallery', 'brick gallery', 'pick pizza', 'my pick best pizza', 'brick oven gallery', 'best pizza']"
826,add to great service great food at reasonable price beginning of great evening .,"['reasonable price', 'reasonable price beginning', 'great service', 'price beginning', 'great evening', 'great service great food', 'great food']"
827,"many people , may not seem like aunthentic thai food place in nyc arent quite authentic .","['food place', 'many people', 'thai place', 'aunthentic place', 'aunthentic thai food place']"
828,"growing up in ny , eaten my share of bagel .",['my share']
829,"oh , even let me start expensive bill !",['expensive bill']
830,hearty two thumb up !,"['hearty thumb', 'hearty two thumb']"
831,scallion pancake fried dumpling nothing of ordinary .,['scallion pancake']
832,"appetizer salad fabulous , steak mouth watering pasta delicious ! !","['pasta delicious', 'steak mouth']"
833,"besides table we promised given to patron twice we actually seated , we served dish we ordered three time , received one of order minute rest of table served order undercooked , charged we on bill .","['minute rest', 'order minute rest', 'order minute', 'three time']"
834,service is top notch .,['top notch']
835,food is inconsistent .,[]
836,pretty good .,[]
837,"also special order kind of dumpling , etc .",['special order']
838,guy rock .,['guy rock']
839,chance is joke .,[]
840,pretty much full fondue appetizer .,"['fondue appetizer', 'full appetizer']"
841,be careful request extra spice .,"['careful request', 'extra spice']"
842,octopus eater floored by octopus salad .,"['octopus eater', 'octopus salad']"
843,we thought is using much of msg cooking in food .,[]
844,at rao last wed .,[]
845,tom kha soup pathetic .,['tom kha soup pathetic']
846,started bombay beer big enough two .,['bombay beer']
847,"decor is vibrant eye pleasing several semi private boths on right side of dining hall , great date .","['right side', 'dining hall', 'semi boths', 'vibrant eye', 'several semi private boths', 'several boths', 'private boths', 'great date']"
848,service quick .,['quick service']
849,tends to turn people away .,[]
850,we thought prelude to evening be like .,[]
851,"turned on to by fellow foodie friend of mine , going back regularly ever since .","['fellow foodie friend', 'foodie friend', 'fellow friend']"
852,drawback service is slow toast !,"['drawback service', 'slow toast']"
853,went an office lunch .,"['office lunch', 'an office lunch']"
854,of at heartland brewery year never disappointed !,"['brewery year', 'heartland brewery year']"
855,"everytime decide to try another on ues , get angry go to zucchero pomodori .",['zucchero pomodori']
856,sweet lassi excellent a lamb chettinad garlic naan but rasamalai forgettable .,"['chettinad garlic naan', 'sweet lassi excellent']"
857,"we ve following chef lyle food around new york year remaining classic , innovation bistro fare made u return return .","['chef lyle food', 'new york year', 'remaining classic', 'lyle food', 'innovation bistro fare', 'york year', 'chef food', 'return return']"
858,best thing tasted lambchop .,['best thing']
859,it delicious !,[]
860,spicy tuna salmon best we ve ever .,"['spicy tuna salmon', 'spicy salmon', 'tuna salmon']"
861,"even though good seafood , price high .",['good seafood']
862,"in addition , food is good price reasonable .","['reasonable price', 'good price']"
863,"upon entering , we greeted by owner , steven frederick , went of way to be gracious host .","['steven frederick', 'gracious host']"
864,"if live outside neighborhood , bother !",[]
865,going since it opened seen quality value decrease considerably .,"['seen quality value', 'seen value', 'quality value']"
866,"meat dish adorn selection , although still large number of vegetarian friendly choice .","['dish selection', 'meat dish adorn selection', 'vegetarian friendly choice', 'friendly choice', 'adorn selection', 'meat dish', 'large number']"
867,never anything like .,['never anything']
868,reasonable price .,['reasonable price']
869,bring service up notch by offerng complementary amuse bouche to table gave u small dessert celebration .,"['small dessert celebration', 'offerng complementary amuse bouche', 'dessert celebration', 'small dessert']"
870,"try crunchy tuna , it is to die .",['crunchy tuna']
871,it break bank but also wouldnt come back food .,[]
872,"in , midtown gem instantly became one of my favorite sushi restaurant in city .","['sushi restaurant', 'midtown gem', 'favorite restaurant', 'my favorite sushi restaurant']"
873,ve to joya twice never go .,[]
874,so rushing u absolutely unnecessary !,[]
875,however it is taiwanese in town .,[]
876,it is lot of fun live entertainment kind of disney type special effect .,"['special effect', 'entertainment kind', 'type special effect', 'live kind']"
877,"if re looking perfect traditional sushi , go if re looking interesting combination , try sushi of gari east side .","['gari side', 'interesting combination', 'gari east side', 'east side', 'perfect sushi', 'perfect traditional sushi', 'traditional sushi']"
878,"no refill on fountain drink , though .","['no refill', 'fountain drink']"
879,wow beer to choose .,['wow beer']
880,be careful of portion re huge .,[]
881,"steak tartare is great bet , fix it at table .","['steak tartare', 'great bet']"
882,my first time happened not to like crab croquette apt ordered happy to change it me without making no big deal .,"['my first time', 'no big deal', 'big deal', 'first time', 'crab croquette apt']"
883,great large group celebration super happy waiter entertainment of evening .,"['super entertainment', 'group celebration', 'great celebration', 'celebration entertainment', 'waiter entertainment', 'happy entertainment', 'large celebration']"
884,mention wine ?,[]
885,"plus , on wednesday night house wine is unlimited !","['house wine', 'wednesday night', 'night wine', 'wednesday night house wine']"
886,it is by far my favorite in brooklyn .,['my favorite']
887,it so crowded loud even talk to person next to .,[]
888,love pizza ..,[]
889,even my indian friend believe good tasty everything .,"['indian friend', 'even my indian friend', 'good tasty everything']"
890,"england , haru best in nyc .",[]
891,less in case .,[]
892,ruby foo is tourist trap .,"['ruby foo', 'tourist trap']"
893,ve couple of time not impressed .,[]
894,ve many time never disappointed .,['many time']
895,ciao bella,['ciao bella']
896,like saying bread come special bakery we seen buying it dowtown manhathan .,['special bakery']
897,dim sum serving bit larger used to .,['dim sum']
898,"however , in summer of , it seems management changed great big door replaced glass front ridding of dark romantic getup .","['great big door', 'front ridding', 'romantic getup', 'dark romantic getup', 'great door', 'glass front', 'dark getup', 'big door', 'glass front ridding']"
899,we go to good meal .,['good meal']
900,it much grown up compared to rest of street .,[]
901,"barbecued codfish gorgeously moist a if poached yet fabulous texture let by curiously bland seasoning spice rub might overwhelmed , however herb mix or sauce would done much to enhance .","['fabulous texture', 'yet fabulous texture', 'herb mix']"
902,we treated attitude ever since moment we stepped !,[]
903,"dinner , take date to huge dance floor , probably one of biggest ll see in ny .","['huge floor', 'dance floor', 'huge dance floor']"
904,taj mahal offeres gret value great food .,"['gret value', 'gret value great food', 'great food']"
905,chef owner changed ? ?,['chef owner']
906,my boyfriend recently an early dinner at artisanal satisfied experience .,"['artisanal experience', 'early dinner', 'artisanal satisfied experience', 'my boyfriend', 'satisfied experience', 'an early dinner']"
907,absolutely loved .,[]
908,wish lived a would eat at a often a possible !,[]
909,"but ever order bacon late at nite either platter or in sandwich , matter take a it is morning frying turn hard almost like bacos , hurt my molar .","['my molar', 'either platter']"
910,"outstanding bagel , but get pay .",['outstanding bagel']
911,"pizza pizza in nyc not additional topping crust taste like best , freshly baked bread !","['crust taste', 'baked bread', 'topping crust', 'additional taste', 'freshly baked bread', 'pizza pizza']"
912,"if re in town , it worth searching another .",[]
913,tried various slice joint around village but is by far best one .,"['various joint', 'various slice joint', 'slice joint']"
914,"found it on cold night , perfect spot to warm up .","['cold night', 'perfect spot']"
915,even section in menu called american chinese food !,"['chinese food', 'american chinese food', 'american food', 'even section']"
916,"service warm attentive , beef carpaachio exellent huge portion pasta fresh well prepared .","['warm attentive', 'huge portion', 'service warm attentive', 'fresh pasta', 'portion pasta']"
917,kalbi nebbiolo do work together .,['kalbi nebbiolo']
918,"best italian food ever italian , mean alot .","['mean alot', 'italian food']"
919,recommend scopa to of my friend to go wonderful italian food .,"['wonderful italian food', 'my friend', 'italian food', 'wonderful food']"
920,located at end of magnificent block .,['magnificent block']
921,"is not worth time , effort , or money to say least .",[]
922,"looking around , saw room full of new yorkers enjoying real meal in real , not clubhouse of fabulous trying to be seen .","['real , not clubhouse', 'real clubhouse', 'new yorkers', 'full room', 'real meal']"
923,keep up good work guy !,"['good guy', 'good work guy', 'work guy']"
924,hurley is terrific !,[]
925,walk around tray of dim sum .,['dim sum']
926,took my sister attending show one evening .,"['my sister', 'one evening']"
927,"great bar , gorgeous bartender ve ever seen specifically blond lady .","['great bar', 'gorgeous bartender', 'blond lady', 'specifically blond lady']"
928,we planning to get dessert but waitress basically bill at u we chance to order .,[]
929,really .,[]
930,really loved different inovated touch cheff give to food .,"['inovated touch', 'different cheff', 'touch cheff', 'different inovated touch cheff']"
931,friend not arrived yet .,[]
932,came cooked cheese almost non existant .,['cooked cheese']
933,"terrific meal , server guided u toward nice wine in price range , instead of allowing u to purchase similarly priced wine a good .","['terrific meal', 'price range', 'nice wine', 'guided u', 'a good', 'server guided u']"
934,"svc be bit rude at time , esp if big group , but overall is must !",['big group']
935,"my husband thougt it would be great to go to jekyll hyde pub anniversary , to surprise it fantastic .","['hyde anniversary', 'my husband', 'pub anniversary', 'jekyll hyde pub anniversary']"
936,never leave feeling unwelcome or impressed .,[]
937,"food is good , especially basic dish , drink delicious .","['basic dish', 'good dish']"
938,but main hit whole grilled fish .,"['main fish', 'grilled fish']"
939,"tuna tartare sake , mushroom ravioli pinot noir , chocolate sampler dessert wine .","['tuna tartare', 'chocolate sampler dessert wine', 'dessert wine', 'sampler wine']"
940,on hot day it fabulous to stop in enjoy lunch .,"['hot day', 'enjoy lunch']"
941,food is delicious beautifully prepared along friendly personable service .,"['friendly service', 'friendly personable service', 'personable service']"
942,usually go later at night get work so to deal crowd or line .,[]
943,pizza is consistently good .,[]
944,we great tiem watching show character ar food we looking .,"['great tiem', 'show character ar food', 'show character', 'character food', 'ar food']"
945,"try by waiter to take it away we even looked at it yet , we full beer yet to drink , manager approached told u needed table people reservation .","['needed people', 'needed table people reservation', 'people reservation', 'table people', 'full beer']"
946,recomend it dinner !,[]
947,sauce watery food much flavor .,"['much flavor', 'watery food']"
948,my husband enjoy sangria .,['my husband']
949,"but last night , spice grill is eating indian cuisine .","['last night', 'indian cuisine', 'spice grill']"
950,we opted pasta dish served timely fresh .,['pasta dish']
951,"first wrong bread came appetizer , tried to order second glass of wine my main course ...","['wrong bread', 'first bread', 'first wrong bread', 'my main course', 'main course', 'second glass']"
952,"not sure previous reviewer , lonk , dined , but saul is in great neighborhood great food !","['previous reviewer', 'not sure previous reviewer', 'great neighborhood', 'sure reviewer', 'great food']"
953,"in an area sadly lacking in decent thai food , is one of best spot .","['thai food', 'an area', 'decent thai food', 'decent food', 'best spot']"
954,tell herky sent get free confused look waiter .,"['free waiter', 'look waiter', 'free confused look waiter', 'confused waiter']"
955,make reservation but expect to be delayed minute a hosting staff difficulty seating guest arrived reservation probably lot of walk in so close to time square .,"['staff difficulty', 'hosting difficulty', 'arrived reservation', 'guest arrived reservation', 'a hosting staff difficulty']"
956,food average or including surprising tasty dish .,"['food average', 'surprising tasty dish', 'surprising dish', 'tasty dish']"
957,seem to an emphasis on special or fresh ingredient to me is necessary good thai .,"['special ingredient', 'an emphasis', 'good thai', 'necessary good thai', 'special or fresh ingredient', 'necessary thai']"
958,apetizers food,[]
959,noodle and rice dish taste great .,['rice dish']
960,food a good a ever .,[]
961,"crust is thin , ingredient fresh staff is friendly .","['ingredient staff', 'fresh staff', 'thin staff']"
962,friend thank introducing to gem !,[]
963,also little expensive average bagel .,"['little bagel', 'average bagel', 'expensive bagel']"
964,"food undercooked sauce watery , vegetable raw .","['undercooked sauce', 'food undercooked sauce']"
965,fried clam enough kick to to make em worth eating .,[]
966,sauce used also not exciting .,[]
967,secret is lunch menu offer complimentary appetizer every entree ordered .,"['lunch menu', 'complimentary appetizer']"
968,absolutely love ! !,[]
969,rice poor quality cooked so badly it hard .,"['rice poor quality', 'poor quality']"
970,we champagne caviar felt like princess !,['champagne caviar']
971,shrimp scampi excellent antipasti plentiful .,"['scampi antipasti', 'shrimp scampi excellent antipasti', 'excellent antipasti']"
972,am surprised to say least find practice not worth effort .,"['not worth effort', 'worth effort']"
973,"my dessert came , candle in it not anyone asked one but waiter must seen me opening my birthday card gift , said he knew it special occassion of sort .","['not anyone', 'card gift', 'my birthday card gift', 'special occassion', 'birthday card', 'my dessert']"
974,"got piece dim sum combo , every bite of great .","['piece combo', 'sum combo', 'every bite', 'piece dim sum combo', 'dim combo']"
975,vietnamese restaurant in chinatown area forget .,"['chinatown area', 'vietnamese restaurant']"
976,is also limited seating be substantial wait in getting food at peak time .,"['peak time', 'limited seating', 'substantial wait']"
977,"if it quick martini at bar recommend jeffery or mind blowing roast chicken , go to village !",['roast chicken']
978,no thanks ! !,['no thanks']
979,"long wait table outside , but it little hot in sun anyway so insde table nice .","['nice table', 'anyway so insde table', 'insde table']"
980,would definently recommend .,[]
981,price wonderfully low .,['low price']
982,if like spicy food get chicken vindaloo .,"['chicken vindaloo', 'spicy food']"
983,love !,[]
984,never disappointed but true strength lay in amazingly delicious cheap lunch special .,"['true strength', 'cheap lunch']"
985,"so much usual bar food , go to enjoy menu sampling one of hand crafted beer .","['crafted beer', 'usual food', 'hand crafted beer', 'bar food']"
986,"big disappointment , around .",['big disappointment']
987,absolutely delicious .,[]
988,no free drink .,"['free drink', 'no free drink']"
989,would say fine tasty but heaviness on my stomach someting not mention or undermine .,"['fine tasty', 'my stomach']"
990,is my first time writing review food service excellent .,"['my first time', 'first time', 'review service', 'review food service', 'food service']"
991,definitely highly not recommended .,[]
992,"keep capex to minimum , do put cash bagel , among best in city .",['cash bagel']
993,huge group my birthday we well taken care of .,['huge group']
994,two star chef left quite time ago to open .,"['star chef', 'quite time', 'two star chef']"
995,waste money on decor .,[]
996,also back garden open in summer cute french outdoor seating could ask ?,"['french seating', 'outdoor seating', 'cute seating']"
997,"go to corned indian , little india strip along east st rule supreme !","['east st rule supreme', 'india strip', ', little india strip', 'little strip']"
998,never eaten piece of relatively good nigiri .,[]
999,"given incredible architecture surrounding it , place no character .","['incredible architecture', 'no character']"
1000,call it an italian dinner .,"['italian dinner', 'an italian dinner']"
1001,my first time my gf month anniversary .,"['my first time', 'my gf month anniversary', 'first time', 'month anniversary', 'gf anniversary']"
1002,"place is not hotspot hangout , drink unique pack lot of bang buck .","['bang buck', 'unique pack lot', 'unique lot', 'hotspot hangout', 'pack lot']"
1003,walked by place eon finally went thanks to girl night .,"['place eon', 'girl night']"
1004,frequented ino several year food remains excellent .,"['several year', 'year food', 'several year food']"
1005,"eggplant is so delicate , sweet tender !","['delicate tender', 'sweet tender']"
1006,pray it stay open forever .,[]
1007,"bite of food at kai indeed delicious , fresh , elegant .","['delicious bite', 'elegant bite']"
1008,food excellent considering quality of food in moderately priced restaurant is mediocre slightly pricey well worth it .,"['priced restaurant', 'moderately priced restaurant', 'excellent food']"
1009,"if want to save money , go .",[]
1010,my friend got mushroom pizza tasted better .,"['my friend', 'mushroom pizza']"
1011,"cod with paella spicy and filling , big eater and could eat half my boyfriend classic fish and chip , big serving at least piece of fish and basketful of fry .","['big fish', 'classic fish', 'least piece', ', big eater', 'big eater', 'at least piece', 'paella spicy']"
1012,"it shame nice , convenient place like pink pony be so ruined by lousy service .","['pink pony', 'convenient place', 'nice , convenient place', 'nice place', 'lousy service']"
1013,is first time citysearch call it right .,['first time']
1014,pas on calamari .,[]
1015,"porcini mushroom pasta special tasteless , so seafood tagliatelle .","['seafood tagliatelle', 'porcini mushroom', 'mushroom tasteless', 'special tasteless']"
1016,try spicy wonton salt pepper shrimp .,"['spicy shrimp', 'pepper shrimp', 'wonton pepper', 'salt pepper']"
1017,food portion really large .,"['food portion', 'large portion']"
1018,fry yummy .,[]
1019,"friendly informative staff , attentive prompt raw bar service .","['friendly informative staff', 'attentive service', 'informative staff', 'bar service', 'friendly staff', 'raw bar', 'prompt service']"
1020,best taiwanese food in ny !,"['best food', 'best taiwanese food', 'taiwanese food']"
1021,eaten at many pizza place around nyc is hand worst .,"['many pizza place', 'many place', 'pizza place']"
1022,is great stop great food .,['great food']
1023,pasta fantastic homemade lasagna is of best in city .,['pasta fantastic homemade lasagna']
1024,?,[]
1025,fantastic !,[]
1026,"dry disgusting , even finish my first piece .","['first piece', 'my first piece', 'dry disgusting']"
1027,highly recommended first date .,"['first date', 'highly recommended first date', 'recommended date']"
1028,"we laughed he finally offered u dessert menu we left percent tip , generous , feel .","['percent tip', 'dessert menu']"
1029,price way to high get .,['price way']
1030,"but people sichuan die it chongqing hot pot , chongqing biggest city of sichuan , became an independent province .","['independent province', 'an independent province', 'biggest city', 'hot pot', 'people sichuan']"
1031,"skip baroanda street eurotrashy , snooty expensive check !","['eurotrashy check', 'expensive check', 'baroanda street']"
1032,skip go to one in soho .,[]
1033,staff ignored my friend entire time we .,"['my friend', 'entire time']"
1034,"yet paired rude service , would never recommend anyone interested in carrying kind of conversation .",['rude service']
1035,"went to areo on sunday afternoon four of my girlfriend , spent three enjoyable hour .","['sunday afternoon', 'my girlfriend', 'three enjoyable hour', 'enjoyable hour']"
1036,"in house lady dj on saturday night outrageously good taste in music , moreover , take request .","['good taste', 'saturday night', 'house lady', 'outrageously good taste']"
1037,"need at least three roll to be full , at least . !",['at least three roll']
1038,anyone ever dined at thai is in huge disappointment .,['huge disappointment']
1039,"of it simply amazing , unique tasty best of it break bank .",[]
1040,"great wine list , reasonably priced . sara","['great list', 'wine list', 'great wine list']"
1041,hot dog cold in middle bun stale .,"['middle bun', 'hot dog']"
1042,"food excellent , it cheap though not extremely expensive either .","['food excellent , it']"
1043,beef noodle soup is good a well .,"['beef soup', 'beef noodle soup', 'noodle soup']"
1044,so sad to read bad review got !,['bad review']
1045,delivery service is great .,['delivery service']
1046,"food dazzling flavor overwhelm palate , truly embracing beauty of authentic thai cuisine .","['thai cuisine', 'authentic thai cuisine', 'authentic cuisine', 'dazzling palate', 'flavor overwhelm', 'overwhelm palate']"
1047,recieved prompt service smile .,"['prompt smile', 'prompt service smile', 'service smile']"
1048,pray to food god to make good pizza like vt .,"['food god', 'good pizza']"
1049,place quiet delightful .,[]
1050,molto bene !,['molto bene']
1051,.the best ve found outside of chinatown master .,['chinatown master']
1052,amazing !,[]
1053,avoid place !,[]
1054,food is diamond in rough food is delicious homemade perfect balance of herb tomato .,"['delicious homemade perfect balance', 'herb tomato', 'homemade balance', 'perfect balance', 'rough food', 'delicious balance']"
1055,must try !,[]
1056,"a much a like food , bring to go back .",['like food']
1057,it looked like shredded cheese partly done still in strip .,['shredded cheese']
1058,price ambience especially great considering it in west village .,"['great ambience', 'west village', 'price ambience']"
1059,soup is pretty good .,[]
1060,it is so easy to get reservation at top in nyc week notice .,"['nyc week notice', 'nyc notice', 'week notice']"
1061,never better enjoyed humble root vegetable or mushroom consomme chef accomplishes without fat .,"['consomme chef', 'humble chef']"
1062,"if go to roth try to be served by mike , he is great ! !",[]
1063,"based on visit month ago , returned week christmas hugely disappointed .","['returned week', 'returned week christmas']"
1064,went on friend reccomendation .,['friend reccomendation']
