id,text,aspects
0,but staff so horrible to u .,"['but staff', 'horrible staff']"
1,"to be completely fair , redeeming factor food , average , but make up deficiency of teodora .","['factor food', 'average food']"
2,"food is uniformly exceptional , capable kitchen proudly whip up whatever feel like eating , whether it on menu or not .","['capable kitchen', 'exceptional kitchen']"
3,gabriela personaly greets recommends to eat .,"['gabriela personaly', 'gabriela personaly greets', 'personaly greets', 'gabriela greets']"
4,"go enjoy it , say is get it .",[]
5,"not food outstanding , but little perk great .","['little perk', 'outstanding food', 'not food']"
6,it is overpriced not tasty .,[]
7,agreed favorite is orrechiete with sausage and chicken usually waiter kind enough to split dish in half so get to sample meat .,"['waiter kind', 'usually waiter kind']"
8,"bagel an outstanding taste terrific texture , chewy yet not gummy .","['outstanding texture', 'terrific texture']"
9,nevertheless food is pretty good .,[]
10,"not mayonnaise , forgot toast , left ingredient ie cheese in an omelet , hot temperature bacon so cooked it crumbled on plate touched it .","['hot temperature', 'temperature bacon', 'not mayonnaise', 'forgot toast', 'omelet bacon']"
11,"it took half an hour to get check , perfect since we could sit , drink talk !",['half an hour']
12,design atmosphere is a good .,['design atmosphere']
13,he visited thailand is quite expert on cuisine .,['quite expert']
14,would definitely recommend mary am making it one of my regular neighborhood haunt .,"['my regular neighborhood haunt', 'regular haunt', 'neighborhood haunt']"
15,pizza is best if like thin crusted pizza .,"['thin pizza', 'thin crusted pizza', 'crusted pizza']"
16,my girlfriend stumbled onto hopping night great time !,"['my girlfriend', 'hopping night', 'great time']"
17,"he help , re bought up so fast .",[]
18,"secondly , on night overwhelmed by upper east side lady perfume .","['east perfume', 'side lady', 'lady perfume', 'upper perfume']"
19,"eaten handful of time , no reason besides sheer convenience .",['sheer convenience']
20,obviously run by folk know pie .,"['folk know pie', 'know pie']"
21,we disappointed .,[]
22,it is definitely special affordable .,[]
23,really liked .,[]
24,be going back soon .,[]
25,"money went interior decoration , none of it went to chef .",['interior decoration']
26,seat uncomfortable if sitting wall on wooden bench .,"['uncomfortable seat', 'wooden bench']"
27,"asked seltzer with lime , no ice .",['no ice']
28,it pretty inexpensive .,[]
29,not be back .,[]
30,"go alone even two people enough whole experience , pickle and selection of meat and seafood .","['enough experience', 'whole experience']"
31,my suggestion is to eat family style ll want to try dish .,"['my suggestion', 'family style']"
32,"best of is warm vibe , owner is super friendly service is fast .","['warm vibe', 'super friendly service', 'friendly service']"
33,value .,[]
34,faan got great concept but little rough on delivery .,['great concept']
35,"incredible food , to warm atmosphere , to friendly service , downtown neighborhood miss beat .","['neighborhood beat', 'incredible food', 'friendly service', 'warm atmosphere', 'miss beat', 'downtown beat']"
36,"great food at reasonable price , make an evening be beat !","['reasonable price', 'great food', 'an evening']"
37,look foward to trying ruben upon returning .,[]
38,steakhouse seems to hold candle to roth is strip house .,['strip house']
39,we usually go to chart house to celebrate birthday or anniversary .,['chart house']
40,little cute interior decor affordable city price .,"['city price', 'affordable city', 'decor price', 'little price', 'cute price']"
41,ll adore it .,[]
42,two word free wine .,"['free wine', 'two word free wine']"
43,price is reasonable although service is poor .,[]
44,"quantity is also good , come satisfied .",[]
45,to roth twice time disappointing .,['twice time']
46,worth visiting st ave it is original store .,"['original store', 'st ave']"
47,"stumbled upon second floor walk up two friday ago two friend in town l.a. serious sushi lover , we sat at sushi bar to be closer to action .","['two friend', 'second floor', 'sushi bar']"
48,"raga is romantic , cozy .",[]
49,fried rice is amazing .,['fried rice']
50,"three course choice include excellent mussel , puff pastry goat cheese salad with delicious dressing , hanger steak au poivre is of world .","['course choice', 'delicious dressing', 'excellent mussel', 'puff pastry goat cheese', 'three course choice', 'puff pastry']"
51,it perfect to amanzing indian food .,['indian food']
52,place is so cool service is prompt curtious .,"['cool service', 'so cool service']"
53,at end re left with mild broth with noodle slurp of cup .,"['mild broth', 'noodle slurp']"
54,wonder delicious meal little money .,"['delicious meal', 'little money', 'delicious meal little money']"
55,food delicious but do not come on empty stomach .,"['food delicious', 'empty stomach']"
56,wine list is excellent .,['wine list']
57,so garantuan fit in toaster .,[]
58,"ive to many thai restaurant in manhattan , toon is by far best thai food ive except my mom of course .","['thai food', 'far best thai food', 'many restaurant', 'many thai restaurant', 'my mom', 'thai restaurant', 'best food']"
59,wouldnt even let me finish my glass of wine offering another .,['my glass']
60,highly recommend sophia pizza .,['sophia pizza']
61,"whem asked , we to ask detailed question so we knew special .",['detailed question']
62,is consistently great to dine lunch or dinner .,[]
63,"nice atmosphere , service pleasant desert good .","['service desert', 'nice atmosphere', 'service pleasant desert', 'pleasant desert']"
64,people bring go back on bring friend !,[]
65,really enjoying at bar we sat at table dinner .,['table dinner']
66,"fabulous service , fantastic food , chilled atmosphere environment .","['chilled environment', 'chilled atmosphere environment', 'fantastic food', 'fabulous service', 'atmosphere environment']"
67,not wanted to hear .,[]
68,try lasagnette appetizer .,['lasagnette appetizer']
69,"pricey , but worth try , at least .",[]
70,"ve time , usually end up sitting next to pretty odd people .","['odd people', 'pretty odd people']"
71,liked beer selection !,['beer selection']
72,"great food , good size menu , great service an unpretensious setting .","['an unpretensious setting', 'size menu', 'unpretensious setting', 'great service', 'good size', 'great food']"
73,go romantic dinner but not an wow dining experience .,"['wow experience', 'dining experience', 'romantic dinner']"
74,wait to go back .,[]
75,grew up eating dosa yet to find in ny to satisfy my taste bud .,"['my taste bud', 'taste bud']"
76,wine list selection is good wine by glass generously filled to top .,"['wine list selection', 'good wine', 'wine list', 'list selection']"
77,"great variety on menu , eat often never get bored .",['great variety']
78,menu is limited think we counted or entree .,[]
79,"if carnivore , come hungry leave satisfied ever .",[]
80,menu is limited but almost of dish excellent .,[]
81,not crazy sake martini .,"['sake martini', 'not crazy sake martini', 'crazy martini']"
82,"great bagel , spread good to hang in .",['great bagel']
83,"service varys day to day sometimes re nice , sometimes not .","['varys day', 'service varys']"
84,"whoever jazz duo , on point .",[]
85,one thing liked is never felt rushed or pressured to give up my table ot incoming guest .,"['my table', 'one thing', 'incoming guest', 'ot incoming guest']"
86,is great bargain .,['great bargain']
87,we happened upon purely by accident pleased result .,"['accident pleased result', 'pleased result']"
88,"unfortunately , food is outstanding , but everything else is pit .",[]
89,deff recimmend bukhara also opened two new location guess ill try .,"['ill try', 'deff recimmend bukhara', 'recimmend bukhara', 'two new location', 'new location']"
90,we always delicious meal always leave feeling satisfied .,[]
91,"dip ingredient in chopstick , swirl around , eat .",['dip ingredient']
92,first went to enjoy garden terrace .,['garden terrace']
93,"my husband perfect , my well done dry .",['my husband']
94,"everyone spoken is super friendly , helpful , willing to extra mile customer .","['extra customer', 'extra mile customer', 'mile customer']"
95,pizza pretty good huge .,['huge pizza']
96,sapphire is indian go to in nyc .,[]
97,"cuisine ve gathered is authentic taiwanese , though different ve accustomed to in taipei .",[]
98,heartily recommend .,[]
99,heartland brewery is by far one of best place in nyc to make new friend catch up old one .,"['old one', 'best place', 'heartland brewery', 'new friend']"
100,almost hesititate to write review atmosphere so great would hate it become to crowded .,['review atmosphere']
101,often crowded on weekend but efficient accurate service .,"['accurate service', 'efficient service', 'efficient accurate service']"
102,my co worker amazed at small dish .,"['co worker', 'my co worker', 'small dish']"
103,"atmosphere is unheralded , service impecible , food magnificant .","['impecible magnificant', 'food magnificant']"
104,"we ordered special , grilled branzino , so infused bone , it difficult to eat .","['grilled branzino', 'infused bone', 'so infused bone', 'special branzino', 'special , grilled branzino']"
105,"wait staff is friendly , food gotten better better !",[]
106,", is month old , is perhaps queen biggest secret !","['biggest secret', 'queen biggest secret']"
107,"it may be bit packed on weekend , but vibe is good it is best french food find in area .","['food find', 'french find', 'french food find']"
108,is so much fun .,"['much fun', 'so much fun']"
109,glad .,[]
110,right in brooklyn is nice cozy place good pizza .,"['cozy place', 'good pizza', 'nice place']"
111,ve never treated so rudely .,[]
112,ll be back soon .,[]
113,le pere pinard pre theater menu is outstanding .,"['theater menu', 'pinard menu', 'pre menu']"
114,went inside started to get excited .,[]
115,also ordered delivery forgot half order .,"['half order', 'delivery forgot']"
116,server checked on u maybe twice entire meal .,"['entire meal', 'maybe twice entire meal']"
117,"however , it is jus good to not praise it .",[]
118,we to montparnasse many time return often good reason .,"['good reason', 'many time']"
119,strong scent coming left right of me negatively affected my taste bud .,"['strong scent', 'my taste bud', 'taste bud']"
120,we lobster sandwich it fantastic .,[]
121,it somewhere eat be happy .,[]
122,"if wrote bad review , it understand rao is .",['bad review']
123,"we stalling could understand coming , but we less an hour even brought u check yet !",['an hour']
124,but overall give it,[]
125,"though spider roll may look like challenge to eat , soft shell crab hanging of roll , it is well worth price pay .","['spider roll', 'shell crab', 'crab hanging', 'worth pay', 'price pay', 'soft crab', 'well worth price pay']"
126,deep fried skewer good still rare to find in nyc .,['fried skewer']
127,"tried to make reservation , but time , hostess my name .",['my name']
128,also recommend rice dish or different variety of congee rice porridge .,"['congee rice porridge', 'rice porridge', 'different variety', 'rice dish', 'congee rice']"
129,tuna tartar appetizer is to die .,"['tuna tartar appetizer', 'tuna appetizer', 'tartar appetizer']"
130,one of best restaurant ve ever to .,['best restaurant']
131,used to be pretty decent .,[]
132,"an oasis of refinement food , though somewhat uneven , often reach pinnacle of new american fine cuisine chef passion kitchen precise execution is evident in fish dish soup .","['fish dish soup', 'fine cuisine', 'kitchen execution', 'passion kitchen', 'refinement food', 'an oasis', 'new kitchen', 'fish dish', 'dish soup', 'precise execution', 'american cuisine', 'cuisine chef', 'chef passion']"
133,"if love wine cheese delicious french fare , ll love artisanal !","['delicious fare', 'french fare', 'wine cheese']"
134,love indian food consider to be quite an expert on it .,"['indian food', 'quite an expert']"
135,baby pizza get wish .,['baby pizza']
136,plenty of choice to make creation .,[]
137,it tiny felt like eating in someone living room .,"['someone living room', 'living room', 'someone room']"
138,on sat .,[]
139,overall oh ya even though is waiting it is deff worth it,[]
140,lava cake dessert incredible recommend it .,"['lava cake dessert incredible', 'lava cake']"
141,vt is baby pizza hope to be grow up .,['baby pizza']
142,"terrible service , to bland food , not to mention unaccommodating manager , overall experience horrible .","['terrible service', 'unaccommodating manager', 'overall experience', 'horrible experience']"
143,lahore is great to duck late night need really tasty food on cheap ll likely trouble finishing amount of food get four dollar .,"['likely trouble', 'really tasty food', 'tasty food', 'four dollar', 'late night', 'finishing amount']"
144,last time went we seated at table in corridor next to kitchen .,['last time']
145,good selection of wine ranging affordable to high end .,"['high end', 'good selection', 'affordable selection']"
146,"nice overall , classic upscale italian decor .","['nice decor', 'classic upscale', 'italian decor', 'overall decor']"
147,not impressed food .,"['not impressed food', 'impressed food']"
148,entire dining experience wonderful !,"['entire experience', 'dining experience', 'entire dining experience']"
149,wine selection by glass bottle is wonderful always recommend friend make reservation if re going to be in town .,"['glass bottle', 'wine selection']"
150,service is highly refined seating delayed minute past reservation maitre apologized regularly kept u apprised of progress .,"['minute maitre', 'reservation maitre', 'past maitre', 'delayed minute']"
151,"order panang duck , it fantastic .",[]
152,"food is usually good , though ocasionally wondered freshmess of raw vegatables in side order .","['side order', 'raw vegatables']"
153,"crappy service two individual , it great .","['two individual', 'crappy service']"
154,ask ?,[]
155,wondering best deal we noticed line formed to wait one particular .,"['best deal', 'noticed line']"
156,authentic indian at amazin price .,"['amazin price', 'authentic indian']"
157,treated like royality .,[]
158,"nice quiet , small but enough or .",[]
159,ambiance relaxed stylish .,"['relaxed stylish', 'ambiance relaxed stylish']"
160,ve never felt unwelcome last month at jimmy bronx cafe .,"['jimmy bronx cafe', 'last month', 'jimmy bronx']"
161,"luckily we saved room bbq salmon , sea bass crispy duck .","['room bbq salmon', 'room salmon', 'sea bass', 'bbq salmon', 'crispy duck', 'bass crispy', 'sea bass crispy duck']"
162,"yes , use fancy ingredient , but even fancy ingredient make good pizza unless someone know to get crust right .","['even fancy ingredient', 'good pizza', 'fancy ingredient']"
163,"looking outside in , one would hesitate to enter hole in wall really , it is .",[]
164,yes dal bukhara is so dam good so kababs .,"['dal bukhara', 'yes dal bukhara']"
165,look forward to eating,[]
166,ve coming a child always come back taste .,['a child']
167,tuk tuk is one of comfortable neighborhood joint know always good meal at fair price .,"['comfortable neighborhood', 'good meal', 'fair price', 'tuk tuk']"
168,"glass of leaping lizard , glass of prosecco , mussel everything happy .",['leaping lizard']
169,"food average creme brulee awful sugar charred , not caramelized smelled of kerosene .","['average creme', 'awful sugar']"
170,food always taste fresh served promptly .,[]
171,know live nearby .,[]
172,pizza is delicious .,[]
173,my entire family horrified .,"['my entire family', 'entire family']"
174,on monthly basis my friend get together girl night .,"['my friend', 'girl night', 'monthly basis']"
175,"pizza garlic knot great a well , order quite often delivery is always super quick !","['pizza garlic knot', 'garlic knot', 'order quite often delivery']"
176,"great chinese food nearby , wu liang ye grand sichuan block away .","['chinese food', 'great food']"
177,but say murray is anything service .,[]
178,"is really trendi but forgotten important part of , food .",['important part']
179,never disappointed in red eye .,['red eye']
180,hat to chef .,[]
181,done in back room away customer .,['back room']
182,"service could be improved but overall is understands importance of little thing heavy , black , antique seeming teapot , one in experience .","['heavy teapot', 'little thing', 'seeming teapot', 'antique teapot', 'black teapot']"
183,glad luxury to throw paying customer .,"['glad luxury', 'paying customer']"
184,"pizza is delicious use fresh mozzarella instead of cheap , frozen , shredded cheese common to pizzaria .","['common cheese', 'cheap cheese', 'shredded cheese', 'frozen cheese', 'fresh mozzarella']"
185,an excellent place to relax food is one of best in city of new york .,"['new york', 'excellent place', 'an excellent place']"
186,"service is friendly , never problem walking in getting table .","['friendly problem', 'friendly , never problem']"
187,atmosphere crowded but it great bistro type vibe .,"['bistro type', 'type vibe', 'great vibe']"
188,check it,[]
189,"first , waitress completely unattentive time we saw odd in table got order wrong .",['unattentive time']
190,go .,[]
191,food bland oily .,['food bland']
192,but do .,[]
193,"is even better , is price affordable a well , food is really good .",[]
194,fish is fresh but variety of fish is nothing of ordinary .,"['fresh variety', 'fresh but variety']"
195,look dont know if people wrote review ever to decent please try someother place .,['someother place']
196,suan challenged loyalty .,[]
197,"favorite meal is pesto pizza , house salad , good bottle of wine .","['pesto pizza', 'good bottle', 'favorite meal']"
198,"kruno , beverage manager is best bartender yet to come across .","['beverage manager', 'best bartender']"
199,"ambiance music funky , enjoy .",['ambiance music']
200,"food , drink service clearly among best in city .",[]
201,went in late afternoon bite size food refleshment my date .,"['my date', 'bite size', 'late afternoon', 'size food', 'afternoon food', 'food refleshment']"
202,"it really great deal , considering we got full of four dollar .","['great deal', 'four dollar']"
203,"understand area folk need not come romantic , alluring ambiance or five star service featuring sommlier complicated maze of captain back waiter come authentic food , taste , experiance .","['star service', 'complicated maze', 'five star service', 'sommlier maze', 'authentic food', 'back waiter', 'sommlier complicated maze', 'area folk']"
204,went mommy person could afford taking me .,['mommy person']
205,my friend on vacation in ny referred to chance by friend .,['my friend']
206,"last time went , waitress come back taking order .",['last time']
207,try tandoori salmon !,['tandoori salmon']
208,"am completely hooked on , it is ridiculous .",[]
209,"eating in , atmosphere save it , but at desk , it disappointing experience .",['disappointing experience']
210,"granted space is smaller , it is best service find in even largest of restaurant .","['best service find', 'best find', 'service find', 'granted space']"
211,"recommended to friend , always get good response .",['good response']
212,we return many time oasis in mid town .,"['time oasis', 'mid town', 'many time oasis', 'many time']"
213,love atmorphere peep !,[]
214,enjoy !,[]
215,we !,[]
216,is one of my favorite restaurant it is not to be missed .,"['my favorite restaurant', 'favorite restaurant']"
217,la rosa is connected by swinging door to mexican pacifico .,"['la rosa', 'mexican pacifico']"
218,it could handled better .,[]
219,service attentive suggestion of menu item right on mark .,"['service attentive suggestion', 'menu item', 'attentive suggestion']"
220,night we three course meal everything delicious if could of licked plate clean would of .,['licked plate']
221,please be aware it cash or amex !,[]
222,"even getting pushed by no class famous ray , sal risen to carry on father uncle legacy smile , true love community , let not forget outstanding pizza !","['no class famous ray', 'father uncle', 'true community', 'outstanding pizza', 'famous ray', 'uncle smile', 'legacy smile', 'true love community', 'father uncle legacy smile', 'love community']"
223,it rather cramped busy it close early .,[]
224,"environment is romantic , but food is horrible , service is pathetic , gabriella lie everything could .",[]
225,"we crawfish boiled despite making mess , it ton of fun quite tasty a well .",['it ton']
226,high expectation made reservation couple of month in advance special occasion .,"['special occasion', 'reservation couple', 'high expectation', 'advance special occasion']"
227,served warm soft fluffy interior .,[]
228,came to table burned beyond recognition stringy .,[]
229,pad thai noodle sticky .,['pad thai']
230,"so ve never actually to proper , but ve it delivered time .",[]
231,"among of new th avenue restaurant , offer by far one of best value for your money .","['new th avenue restaurant', 'your money', 'avenue restaurant', 'best value', 'new restaurant']"
232,"frankly , compare lunch , versus mcds or so many sandwich shop in city , is no comparison .","['compare lunch', 'no comparison', 'so many sandwich shop', 'many shop', 'sandwich shop']"
233,hostess is rude to point of offensive .,[]
234,"if re craving haru great food , especially house roll , but stand wait building outisde , head across street to sake bar !","['haru great food', 'house roll', 'great food', 'especially house roll']"
235,"narrow corridor lead to tiny space three tiny white tiled counter , great deal of mess stack of bottle , can small counter holding entree .","['tiny space', 'white counter', 'mess stack', 'corridor lead', 'narrow lead', 'small counter', 'tiled counter', 'great deal', 'narrow corridor lead']"
236,food is great .,[]
237,succulent steak cooked precisely to desired doneness accompanied by salad side look like leafy road kill .,"['leafy road kill', 'desired doneness', 'side look', 'leafy road', 'salad side look', 'salad look', 'succulent steak', 'road kill']"
238,"lunch came pickels and slaw , no extra charge .",['extra charge']
239,decent wine at reasonable price .,"['reasonable price', 'decent wine']"
240,conveniently delivered right to door .,[]
241,even the wine by the glass good .,"['even the wine', 'good wine', 'the glass']"
242,nice family owned traditional .,['nice family']
243,would rather tried terrace in sky or water club price,['water club']
244,dish is my favorite always get it go never get tired of it .,[]
245,"also ordered change mojito , of world .",['change mojito']
246,okay service .,['okay service']
247,thing wonderful food is exceptional is service .,"['thing wonderful food', 'wonderful food']"
248,we pleasantly surprised .,[]
249,"food awful , atrocious actually .",[]
250,never visit .,[]
251,the soup for the udon soy sauce water .,"['soy sauce', 'sauce water', 'the soup', 'udon water']"
252,"anti pasta excellent , especially calamari , a filling pasta main .",['filling pasta']
253,waitress suggested glass of wine went well food .,['well food']
254,"or sister , in my case ! .","['or sister', 'my case']"
255,ve eaten at many different indian restaurant .,"['many different indian restaurant', 'indian restaurant', 'different restaurant', 'many restaurant']"
256,"might be business at counter give order , but food say love .",['give order']
257,"we particular sushi please every choice included ceviche mix special , crab dumpling , assorted sashimi , sushi roll , two type of sake , banana tempura .","['ceviche mix', 'sushi roll', 'particular sushi', 'assorted sashimi', 'special type', 'dumpling sashimi', 'every choice', 'banana tempura']"
258,try plain pizza fresh garlic or eggplant .,"['plain pizza fresh garlic', 'fresh garlic', 'plain pizza']"
259,go !,[]
260,"ok , so server wander around little clueless , but enough server crowd get it fine , to make small effort to get attention .","['enough crowd', 'enough server crowd', 'little clueless', 'server crowd', ', so server', 'small effort']"
261,good luck getting table .,['good luck']
262,"we picked it randomly , without recommendation someone , so we sure to expect .",['recommendation someone']
263,look nose at me like ...,[]
264,planet thai is great !,['planet thai']
265,service is awful .,[]
266,do it .,[]
267,ignore trendy wannabe .,['trendy wannabe']
268,"takeout menu say to keep an eye an expanded menu offering italian dish , wait !","['an expanded menu', 'italian dish', 'expanded menu', 'an eye', 'takeout menu']"
269,"trust me , it be great , of it be devoured in no time .",['no time']
270,my girlfiends ate at o.g . last night .,"['last night', 'my girlfiends']"
271,wish one near my office would go everyday .,['my office']
272,finally !,[]
273,amma worst value money experienced in nyc past year .,"['value money', 'past year', 'worst money', 'amma worst value money']"
274,"am not experienced person it come to thai food , but my friend took me is .","['am not experienced person', 'thai food', 'my friend', 'experienced person']"
275,think would be pretty good if it not so overpriced overrated .,[]
276,regardless of whether two people or two hundred people ahead of hostess take name tell five minute .,"['five minute', 'two people', 'take name', 'hostess name', 'hostess take name', 'two hundred people']"
277,pizza is good though .,[]
278,bottle of wine cheap good .,['good bottle']
279,not be disapointed at .,[]
280,walk in risky .,[]
281,"different beer to offer thier guest so made my husband happy food delicious , if must recommend dish it must be pumkin tortelini .","['my husband', 'different beer', 'thier guest']"
282,give u dinner special we asked it .,['dinner special']
