id,text,aspects,sentence
2344,we ended great experience by gulab jamun dessert recommended by waiter .,"['great experience', 'gulab jamun dessert']",we ended great experience by gulab jamun dessert recommended by waiter .
2345,wont come back sure !,[],wont come back sure !
2346,went to utsav yr ago my family .,[],went to utsav yr ago my family .
2347,"compare mamoun in term of price , freshness , value , consisent quality , but my opinion .","['consisent quality', 'compare mamoun', 'my opinion']","compare mamoun in term of price , freshness , value , consisent quality , but my opinion ."
2348,"place is sleek , modern playfull return frequently .","['sleek return', 'playfull return', 'modern return']","place is sleek , modern playfull return frequently ."
2349,"known secret last year , emilio godfather continued to serve food wine god at mortal price .","['mortal price', 'food wine', 'known secret', 'last year', 'food wine god', 'emilio godfather']","known secret last year , emilio godfather continued to serve food wine god at mortal price ."
2350,brioche and lolly a party favor is cute and sweet touch to memorable meal .,"['memorable meal', 'cute and sweet touch', 'cute touch', 'lolly a party favor', 'party favor']",brioche and lolly a party favor is cute and sweet touch to memorable meal .
2351,"told party of three would be seated in minute watching party multiple of higher seated minute , three of u squished small person table .","['small person', 'higher minute', 'party multiple', 'small person table', 'higher seated minute', 'seated minute', 'person table']","told party of three would be seated in minute watching party multiple of higher seated minute , three of u squished small person table ."
2352,bill outragous .,[],bill outragous .
2353,"service attentive , yet unimposing , food far better many notorious restaurant in midtown wine list is extensive well priced .","['many restaurant', 'unimposing restaurant', 'midtown list', 'midtown wine list', 'better restaurant', 'notorious restaurant', 'attentive service', 'wine list']","service attentive , yet unimposing , food far better many notorious restaurant in midtown wine list is extensive well priced ."
2354,"kind , attentive wait staff .","['kind staff', 'attentive staff', 'wait staff']","kind , attentive wait staff ."
2355,bon appettite ! !,['bon appettite'],bon appettite ! !
2356,salad fantastic .,[],salad fantastic .
2357,owner employee friendly pizza is fantastic .,"['friendly pizza', 'owner employee friendly pizza', 'owner pizza']",owner employee friendly pizza is fantastic .
2358,"la rosa waltz in , think it best .",['la rosa waltz'],"la rosa waltz in , think it best ."
2359,"food is yummy , especially cooked to perfection mussel in spicy tomato sauce shoestring crispy fry .","['spicy sauce', 'tomato sauce', 'perfection mussel']","food is yummy , especially cooked to perfection mussel in spicy tomato sauce shoestring crispy fry ."
2360,food is authentic italian delicious !,['authentic italian delicious'],food is authentic italian delicious !
2361,"great addition to smith street finally , not pretentious filled woman wearing ugg boot .","['filled woman', 'pretentious woman', 'great addition', 'smith street', 'ugg boot']","great addition to smith street finally , not pretentious filled woman wearing ugg boot ."
2362,skip dessert .,['skip dessert'],skip dessert .
2363,we spent in left hungry disappointed .,[],we spent in left hungry disappointed .
2364,it is simply amazing .,[],it is simply amazing .
2365,complete total bagel experience by it lightly toasted .,"['complete total bagel experience', 'complete experience', 'total experience', 'bagel experience']",complete total bagel experience by it lightly toasted .
2366,it like server forgot actually worked instead wanted to hang be cool .,['server forgot'],it like server forgot actually worked instead wanted to hang be cool .
2367,liked first time but doubt ever return .,['first time'],liked first time but doubt ever return .
2368,service is good ambience is good date or group outing .,"['good ambience', 'good date', 'group outing']",service is good ambience is good date or group outing .
2369,great way to make money is to buy case of snapple costco sell it right outside . .,"['great way', 'snapple costco']",great way to make money is to buy case of snapple costco sell it right outside . .
2370,it food ! !,['it food'],it food ! !
2371,fast service .,['fast service'],fast service .
2372,"skip , it big disappointment .",['big disappointment'],"skip , it big disappointment ."
2373,"staff is excellent , specjal girl behind bar , european chic .","['excellent , specjal girl', 'specjal girl', 'excellent girl']","staff is excellent , specjal girl behind bar , european chic ."
2374,"stick chicken , beef , lamb dish .","['lamb dish', 'stick chicken']","stick chicken , beef , lamb dish ."
2375,"service bad , food took to forever to come , we sat on upper level .","['bad service', 'upper level']","service bad , food took to forever to come , we sat on upper level ."
2376,"we menu rearely change , xcept one or two special , quality care put in thier food in evident .","['thier food', 'quality care']","we menu rearely change , xcept one or two special , quality care put in thier food in evident ."
2377,always full tourist especially of it close proximity to rockefeller center .,"['full tourist', 'rockefeller center', 'always full tourist', 'close proximity']",always full tourist especially of it close proximity to rockefeller center .
2378,"decor is nice , but casual fine .",['casual fine'],"decor is nice , but casual fine ."
2379,is wonderful to go many time it is reasonably priced .,['many time'],is wonderful to go many time it is reasonably priced .
2380,"bravo , blue hill !",['blue hill'],"bravo , blue hill !"
2381,"conveniently located , right on bedford ave .",['bedford ave'],"conveniently located , right on bedford ave ."
2382,my friend came across walking in village .,['my friend'],my friend came across walking in village .
2383,"bottom line food , service .","['bottom line', 'line food']","bottom line food , service ."
2384,thing waiter do is wipe chin leave .,"['thing waiter', 'wipe leave', 'chin leave', 'wipe chin leave']",thing waiter do is wipe chin leave .
2385,is to be avoided .,[],is to be avoided .
2386,"stick to dimsum , not super overpriced noodle .",['overpriced noodle'],"stick to dimsum , not super overpriced noodle ."
2387,service is fine allow to enjoy view .,[],service is fine allow to enjoy view .
2388,my sister say it reminds of run by high school student know .,"['high school student', 'school student', 'high school', 'my sister']",my sister say it reminds of run by high school student know .
2389,"we , four of u , arrived at noon empty staff acted like we imposing on rude .","['empty staff', 'noon empty staff']","we , four of u , arrived at noon empty staff acted like we imposing on rude ."
2390,"at , we third party .",['third party'],"at , we third party ."
2391,delicious simple food in nice outdoor atmosphere .,"['outdoor atmosphere', 'delicious food', 'simple food', 'nice outdoor atmosphere', 'delicious simple food']",delicious simple food in nice outdoor atmosphere .
2392,definetly be going back .,[],definetly be going back .
2393,"no , really .",[],"no , really ."
2394,"food is good , but expensive casualness of it .",['expensive casualness'],"food is good , but expensive casualness of it ."
2395,fallback on is price .,[],fallback on is price .
2396,ve to naples dinner twice .,[],ve to naples dinner twice .
2397,hot sour soup unbearably hot tasted of pepper nothing else .,"['sour soup', 'hot sour soup', 'hot soup']",hot sour soup unbearably hot tasted of pepper nothing else .
2398,love pic of andy warhol he used to frequent he painted ballato sign in window .,"['andy warhol', 'love pic', 'ballato sign']",love pic of andy warhol he used to frequent he painted ballato sign in window .
2399,try sushimi cucumber roll .,"['sushimi cucumber roll', 'sushimi roll', 'cucumber roll']",try sushimi cucumber roll .
2400,saving up my next visit .,"['my next visit', 'next visit']",saving up my next visit .
2401,food is delicious .,[],food is delicious .
2402,wine by the glass great accompaniment eat like king wine .,"['the glass great accompaniment', 'king wine', 'great accompaniment']",wine by the glass great accompaniment eat like king wine .
2403,place correct ambience an excellent staff to make feel like guest friend at time .,"['an excellent staff', 'guest friend', 'correct ambience', 'excellent staff']",place correct ambience an excellent staff to make feel like guest friend at time .
2404,amma is nothing special .,[],amma is nothing special .
2405,yeah shanghai is also great but not quite a good use amount of salt but without sweetness to balance .,"['good amount', 'use amount']",yeah shanghai is also great but not quite a good use amount of salt but without sweetness to balance .
2406,"believe u , we ve eating sushi yr .",[],"believe u , we ve eating sushi yr ."
2407,"worth it special occasion , or time !",['special occasion'],"worth it special occasion , or time !"
2408,atmosphere is much better sripraphai modern sleek .,"['better sleek', 'modern sleek', 'sripraphai sleek']",atmosphere is much better sripraphai modern sleek .
2409,recommend to anyone want to dress up impress lady .,['impress lady'],recommend to anyone want to dress up impress lady .
2410,"food is outstanding service is quick , friendly professional .",['outstanding service'],"food is outstanding service is quick , friendly professional ."
2411,"bagel always warm , soft on inside , crispy on outside enormous in size .",[],"bagel always warm , soft on inside , crispy on outside enormous in size ."
2412,"late dinner at lucky stike , great name if ever saw one .","['lucky stike', 'late dinner', 'great name']","late dinner at lucky stike , great name if ever saw one ."
2413,", done , new york , it not big deal .",['big deal'],", done , new york , it not big deal ."
2414,definitely year treat look forward to around holiday !,[],definitely year treat look forward to around holiday !
2415,service is fast friendly .,[],service is fast friendly .
2416,an english speaking staff .,"['english staff', 'speaking staff', 'an english speaking staff']",an english speaking staff .
2417,"anyhow , we able to sit a long a we wanted chat , nice .",['a long a'],"anyhow , we able to sit a long a we wanted chat , nice ."
2418,home made potato chip at bar delicious thing in world !,"['potato chip', 'delicious thing', 'bar delicious thing']",home made potato chip at bar delicious thing in world !
2419,defitely must visit .,[],defitely must visit .
2420,my husband enjoyed of taste size portion left completely full .,"['my husband', 'size portion', 'taste size', 'taste size portion']",my husband enjoyed of taste size portion left completely full .
2421,"went friend on whim , we went someplace else first get table .",[],"went friend on whim , we went someplace else first get table ."
2422,"we ate pasta entre e , great .",['pasta entre e'],"we ate pasta entre e , great ."
2423,my friend showed up on sat .,['my friend'],my friend showed up on sat .
2424,steak excellent one of best tasted butter intitally but in no way it overwhelm flavor of meat .,"['best tasted butter', 'tasted butter', 'no way']",steak excellent one of best tasted butter intitally but in no way it overwhelm flavor of meat .
2425,great experience overall .,['great experience'],great experience overall .
2426,perfect date !,['perfect date'],perfect date !
2427,food boring expensive .,[],food boring expensive .
2428,"ambience is pretty nice conversation , so casual lunch would probably be best .","['nice conversation', 'pretty nice conversation', 'casual lunch']","ambience is pretty nice conversation , so casual lunch would probably be best ."
2429,terrific menu full of unique roll special dish .,"['unique dish', 'full menu', 'special dish', 'unique roll special dish', 'terrific menu']",terrific menu full of unique roll special dish .
2430,service is ok but could be better .,[],service is ok but could be better .
2431,"we love food , drink , atmosphere !",[],"we love food , drink , atmosphere !"
2432,week back we worst customer service experience at ever .,"['service experience', 'worst experience', 'customer service']",week back we worst customer service experience at ever .
2433,ve ordered nd ave .,['nd ave'],ve ordered nd ave .
2434,"nothing good sale call , but tactic at amma obvious .","['good sale call', 'sale call', 'good call']","nothing good sale call , but tactic at amma obvious ."
2435,"went on day oyster binge , fish bringing up closing , am so glad place it trip ended , it so great !","['so glad place', 'glad place', 'oyster binge', 'day oyster binge', 'day binge']","went on day oyster binge , fish bringing up closing , am so glad place it trip ended , it so great !"
2436,"took my mom mother day , maitre pretty rude .","['mother day', 'my mom']","took my mom mother day , maitre pretty rude ."
2437,my husband couple of time time we sat at sushi bar chef yoshi ordered everything ala carte .,"['sushi bar chef yoshi', 'everything carte', 'sushi chef', 'ala carte', 'bar chef', 'everything ala carte']",my husband couple of time time we sat at sushi bar chef yoshi ordered everything ala carte .
2438,"vibe is relaxed cozy , service great food excellent !",['great food'],"vibe is relaxed cozy , service great food excellent !"
2439,"if weather is nice , try to snag an outside table .","['an outside table', 'outside table']","if weather is nice , try to snag an outside table ."
2440,"if looking good quality , cheap eats is .","['good quality', 'cheap eats']","if looking good quality , cheap eats is ."
2441,"however , we spent , overall , it not up to par .",[],"however , we spent , overall , it not up to par ."
2442,service friendly atmosphere casual .,['friendly atmosphere'],service friendly atmosphere casual .
2443,friend seattle went on thursday night around .,"['friend seattle', 'thursday night']",friend seattle went on thursday night around .
2444,lived upstate would buy freeze bagel would still be better else .,['freeze bagel'],lived upstate would buy freeze bagel would still be better else .
2445,"recommend pad see ew , pork chop or tofu plate .","['pad see', 'pork chop', 'tofu plate']","recommend pad see ew , pork chop or tofu plate ."
2446,never in my life think could be satisfied in taste in quantity . in nyc .,['my life'],never in my life think could be satisfied in taste in quantity . in nyc .
2447,"is best secret in midtown , heard bartender , brilliant food try steak with portobello mushroom drink on bar last tuesday .","['portobello mushroom drink', 'portobello drink', 'brilliant food', 'mushroom drink']","is best secret in midtown , heard bartender , brilliant food try steak with portobello mushroom drink on bar last tuesday ."
2448,service excellent friendly attentive .,"['service excellent friendly attentive', 'friendly attentive']",service excellent friendly attentive .
2449,"main course an average portion , decent overall .","['an average portion', 'decent portion', 'average portion', 'main course']","main course an average portion , decent overall ."
2450,minute reservation but it gave u time to cocktail enjoy surroundings .,"['minute reservation', 'enjoy surroundings']",minute reservation but it gave u time to cocktail enjoy surroundings .
2451,"remember , later go , longer may to wait .",[],"remember , later go , longer may to wait ."
2452,"waitstaff is great , attentive .",[],"waitstaff is great , attentive ."
2453,live in neightborhood am regular .,[],live in neightborhood am regular .
2454,dinner menu is diverse top notch a well .,"['diverse notch', 'diverse top notch', 'dinner menu', 'top notch']",dinner menu is diverse top notch a well .
2455,it is modern cuisine is .,['modern cuisine'],it is modern cuisine is .
2456,"in event , even though bit on pricey side , we still love definitely go back .",['pricey side'],"in event , even though bit on pricey side , we still love definitely go back ."
2457,definitely go back .,[],definitely go back .
2458,"like indian food much delicious , however want to factor equation .",['indian food'],"like indian food much delicious , however want to factor equation ."
2459,"at taj , vegetarian rejoice dish manna heaven .",['dish manna'],"at taj , vegetarian rejoice dish manna heaven ."
2460,finally !,[],finally !
2461,"forget rush wait noise actually bad , mean please , go to steakhouse to be coddled romantic ?","['wait noise', 'rush noise', 'rush wait noise']","forget rush wait noise actually bad , mean please , go to steakhouse to be coddled romantic ?"
2462,"hunted around quiet , romantic , yet not hideously expensive stumbled across review la lanterna gave it shot .",['review la lanterna'],"hunted around quiet , romantic , yet not hideously expensive stumbled across review la lanterna gave it shot ."
2463,ve never disappointed .,[],ve never disappointed .
2464,go back unless someone else is footing bill .,['footing bill'],go back unless someone else is footing bill .
2465,"we live in new jersey whenever we go new york city we buy bagel to eat hot to freeze told me if call in order , bring it to car so to look parking .","['new jersey', 'york city', 'new york city']","we live in new jersey whenever we go new york city we buy bagel to eat hot to freeze told me if call in order , bring it to car so to look parking ."
2466,"street it look hidden , is actually an old warehouse .","['old warehouse', 'an old warehouse']","street it look hidden , is actually an old warehouse ."
2467,jimmy is hand hottest night spot in bronx .,"['hottest night spot', 'hottest spot', 'night spot']",jimmy is hand hottest night spot in bronx .
2468,would to agree mass in term of service delivery is achilles heel .,"['service delivery', 'achilles heel']",would to agree mass in term of service delivery is achilles heel .
2469,my boyfriend to minnow four time we consistently impressed .,['my boyfriend'],my boyfriend to minnow four time we consistently impressed .
2470,"bill bit steep , but experience great .",[],"bill bit steep , but experience great ."
2471,"mind going back time , but not trying others nearby .",[],"mind going back time , but not trying others nearby ."
2472,"nice ambiance , nice little bar , good bartender , francois , good service .","['good service', 'nice ambiance', 'nice bar', 'nice little bar', 'good bartender', 'little bar']","nice ambiance , nice little bar , good bartender , francois , good service ."
2473,found to be one truly value patron .,"['one truly value patron', 'value patron']",found to be one truly value patron .
2474,"calamari come an incredible sauce , duck noodle yummy a well .","['incredible sauce', 'an incredible sauce', 'duck noodle']","calamari come an incredible sauce , duck noodle yummy a well ."
2475,would definitely go back if of exotic martini on blackboard .,['exotic martini'],would definitely go back if of exotic martini on blackboard .
2476,"reason empty we got in remained so entire evening , understand but we blast definately go back next time we in area .","['so entire evening', 'empty reason', 'next time', 'entire evening']","reason empty we got in remained so entire evening , understand but we blast definately go back next time we in area ."
2477,simple comfort food hot lage portion .,"['hot lage', 'comfort lage', 'lage portion', 'simple portion']",simple comfort food hot lage portion .
2478,but would like to say read review people left thats checked it .,[],but would like to say read review people left thats checked it .
2479,"stay away two specialty roll on menu , though much avocado rice fill up right quick .","['specialty roll', 'two specialty roll', 'avocado rice', 'much rice', 'though much avocado rice']","stay away two specialty roll on menu , though much avocado rice fill up right quick ."
2480,"ve eaten at pizza gruppo time , but often order delivery .","['gruppo time', 'often order']","ve eaten at pizza gruppo time , but often order delivery ."
2481,we get drink refill even offer u option of dessert .,[],we get drink refill even offer u option of dessert .
2482,beautiful experience .,['beautiful experience'],beautiful experience .
2483,bagel also reasonably priced nyc .,[],bagel also reasonably priced nyc .
2484,"if handle , it great business dinner , fun friend or simply table .","['great dinner', 'fun friend', 'business dinner', 'simply table']","if handle , it great business dinner , fun friend or simply table ."
2485,decor leaf something to be desired .,"['decor leaf', 'decor leaf something']",decor leaf something to be desired .
2486,jimmy is dominican !,[],jimmy is dominican !
2487,"also , specify if like food spicy rather bland if .",['food spicy'],"also , specify if like food spicy rather bland if ."
2488,"waiter fine , place look nice in not trying hard way , but at price , little be expected of food .","['hard way', 'waiter fine']","waiter fine , place look nice in not trying hard way , but at price , little be expected of food ."
2489,coming boston is like emma pizza in kendall square in cambridge although funky topping !,"['funky topping', 'emma pizza', 'kendall square', 'coming boston']",coming boston is like emma pizza in kendall square in cambridge although funky topping !
2490,"my husband go , we spend . lobster tail umm need say say , it place ll never forget if never go , ll miss meal of life time","['my husband', 'life time']","my husband go , we spend . lobster tail umm need say say , it place ll never forget if never go , ll miss meal of life time"
2491,"in an effort to increase turnover , offer no dessert beyond complimentary espresso cup filled with chocolate mousse .","['no dessert', 'an effort', 'espresso cup', 'complimentary espresso cup', 'chocolate mousse', 'complimentary cup']","in an effort to increase turnover , offer no dessert beyond complimentary espresso cup filled with chocolate mousse ."
2492,"ve to dozen time craving pho , lemon grass chicken or beef cube on rice , is to go .","['lemon grass chicken', 'craving pho', 'time pho', 'lemon grass', 'beef cube', 'time craving pho', 'grass chicken']","ve to dozen time craving pho , lemon grass chicken or beef cube on rice , is to go ."
2493,"oh yes , if fan of indian oldie film star , plenty of portrait of indian actor actress in classic black white adorn wall , of , would love to know obtained .","['black wall', 'classic wall', 'indian oldie film star', 'indian actor actress', 'actor actress', 'indian actress', 'adorn wall']","oh yes , if fan of indian oldie film star , plenty of portrait of indian actor actress in classic black white adorn wall , of , would love to know obtained ."
2494,"food is spectacular , appitizers to main course , of course dessert , wow ll need no .",['main course'],"food is spectacular , appitizers to main course , of course dessert , wow ll need no ."
2495,neighborhood nice though so check another instead .,['nice neighborhood'],neighborhood nice though so check another instead .
2496,my fish delicious in an incredible curry sauce .,"['an incredible curry sauce', 'incredible sauce', 'my fish', 'curry sauce']",my fish delicious in an incredible curry sauce .
2497,if in search of authentic nyc deli experience look no famous historic katz deli on lower east side .,"['nyc experience', 'lower side', 'deli experience', 'east side', 'lower east side', 'authentic nyc deli experience', 'authentic experience']",if in search of authentic nyc deli experience look no famous historic katz deli on lower east side .
2498,"even upon delivery , juicy pork bun quite good . .","['juicy bun', 'good bun', 'pork bun', 'juicy pork bun']","even upon delivery , juicy pork bun quite good . ."
2499,is also .,[],is also .
2500,everything is sale in including sculptured iron statue on table .,"['iron statue', 'sculptured statue', 'sculptured iron statue']",everything is sale in including sculptured iron statue on table .
2501,"average to good thai food , but terrible delivery .","['good thai food', 'thai food', 'terrible delivery']","average to good thai food , but terrible delivery ."
2502,space is nice but we order drink we in surprise .,[],space is nice but we order drink we in surprise .
2503,entire place treatment we received felt a conveyor belt .,"['conveyor belt', 'entire treatment', 'entire place treatment', 'a conveyor belt', 'place treatment']",entire place treatment we received felt a conveyor belt .
2504,joe pizza used to best slice pizzeria opened up .,"['best slice pizzeria', 'joe pizza', 'best pizzeria', 'slice pizzeria']",joe pizza used to best slice pizzeria opened up .
2505,in reality felt a if gotten air france in th district in paris .,[],in reality felt a if gotten air france in th district in paris .
2506,never anything like it !,['never anything'],never anything like it !
2507,"yeah crowd take it bit seriously , but it .",[],"yeah crowd take it bit seriously , but it ."
2508,provided delicious dessert on house !,['delicious dessert'],provided delicious dessert on house !
2509,"still living in dark age do not an answering machine , so if want to make reservation limited .","['not an answering machine', 'answering machine', 'dark age']","still living in dark age do not an answering machine , so if want to make reservation limited ."
2510,"food is amazing , rich pasta fresh doughy pizza .","['amazing pizza', 'rich pizza', 'fresh pizza', 'doughy pizza']","food is amazing , rich pasta fresh doughy pizza ."
2511,"food good , but not would consider of world .",['good food'],"food good , but not would consider of world ."
2512,lobster bisque it oz . of maine lobster in it .,['maine lobster'],lobster bisque it oz . of maine lobster in it .
