id,text,aspects,sentence
1522,"my pick scallion pancake fried vegetable juice , special tasty guizhou chicken shredded squid family style one of my personal favorite sichuan spicy soft shell crab shuizhu fish one is hardcore sichuan food fan , recommend to my american friend a it spicy .","['a it spicy', 'personal fish', 'shredded style', 'fried vegetable juice', 'spicy fish', 'hardcore sichuan food fan', 'family style', 'my american friend', 'favorite fish', 'shell crab', 'food fan', 'vegetable juice', 'squid style', 'shuizhu fish', 'american friend', 'my pick scallion', 'sichuan fan', 'crab shuizhu', 'pick scallion', 'soft shell', 'it spicy', 'fried juice', 'hardcore fan']","my pick scallion pancake fried vegetable juice , special tasty guizhou chicken shredded squid family style one of my personal favorite sichuan spicy soft shell crab shuizhu fish one is hardcore sichuan food fan , recommend to my american friend a it spicy ."
1523,smell like stuff old canned vegetable like spinach mushroom calzone .,"['stuff old canned vegetable', 'spinach mushroom calzone', 'old vegetable', 'spinach mushroom', 'mushroom calzone', 'canned vegetable']",smell like stuff old canned vegetable like spinach mushroom calzone .
1524,"to celebrate birthday , three of u went to mare anticipating great food .",['great food'],"to celebrate birthday , three of u went to mare anticipating great food ."
1525,great deal blue point oyster beer or glass of wine !,"['great beer', 'blue point', 'oyster beer', 'point beer']",great deal blue point oyster beer or glass of wine !
1526,really liked noodle dish at rice avenue compared to green curry dish .,"['noodle dish', 'curry dish', 'green curry dish', 'rice avenue']",really liked noodle dish at rice avenue compared to green curry dish .
1527,"went to pams my girlfriend , love it .",['my girlfriend'],"went to pams my girlfriend , love it ."
1528,"but whatever reason , price twice a high .",['twice a high'],"but whatever reason , price twice a high ."
1529,am relatively new to area tried pick bgel on nd disappointed service thought food overated on pricey side .,"['thought food', 'service thought', 'disappointed food', 'pricey side']",am relatively new to area tried pick bgel on nd disappointed service thought food overated on pricey side .
1530,great atmoshere worth every bit .,[],great atmoshere worth every bit .
1531,we unpleasant experience at .,[],we unpleasant experience at .
1532,"spicy tuna roll unusually good rock shrimp tempura awesome , great appetizer to share !","['good shrimp', 'great appetizer', 'rock shrimp', 'unusually good rock shrimp', 'spicy tuna', 'awesome appetizer', 'tuna roll']","spicy tuna roll unusually good rock shrimp tempura awesome , great appetizer to share !"
1533,staff knowledgeable full of personality .,[],staff knowledgeable full of personality .
1534,great staff .,['great staff'],great staff .
1535,"complaint would be at an average cost of per meal , like not to to worry finding seat !","['average cost', 'an average cost']","complaint would be at an average cost of per meal , like not to to worry finding seat !"
1536,"to finish delightful dinner experience must dessert , especially white chocolate bread pudding with gelato and hot chocolate .","['delightful experience', 'dinner experience', 'bread pudding', 'chocolate bread', 'gelato and hot chocolate', 'delightful dinner experience', 'white chocolate']","to finish delightful dinner experience must dessert , especially white chocolate bread pudding with gelato and hot chocolate ."
1537,banana tower is an amazing dessert a well .,"['amazing dessert', 'banana tower', 'an amazing dessert']",banana tower is an amazing dessert a well .
1538,went my friend last saturday .,['my friend'],went my friend last saturday .
1539,"excellent atmosphere , delicious dish good friendly service .","['good service', 'excellent atmosphere', 'friendly service', 'delicious service']","excellent atmosphere , delicious dish good friendly service ."
1540,cool place to hang friend couple of healthy drink dessert .,"['drink dessert', 'cool place', 'healthy drink', 'friend couple', 'healthy drink dessert']",cool place to hang friend couple of healthy drink dessert .
1541,"great vibe , lot of people .",['great vibe'],"great vibe , lot of people ."
1542,"like mamoun food a well , but side by side , kati roll produce tastier food hand .","['tastier food hand', 'food hand', 'mamoun food', 'tastier hand', 'kati roll']","like mamoun food a well , but side by side , kati roll produce tastier food hand ."
1543,an odd group .,"['an odd group', 'odd group']",an odd group .
1544,"service is bit slow , but harkens back to my year growing up in napoli , italy thing not rushed sit dinner table is night .","['italy thing', 'dinner table', 'sit dinner table', 'my year', 'sit table']","service is bit slow , but harkens back to my year growing up in napoli , italy thing not rushed sit dinner table is night ."
1545,"either , or editor idea of romance must be sharing conversation next table , trying to speak louder traffic on th .","['editor idea', 'next table', 'louder traffic']","either , or editor idea of romance must be sharing conversation next table , trying to speak louder traffic on th ."
1546,love !,[],love !
1547,it is not consistent .,[],it is not consistent .
1548,but the icing on the cake tiramisu resembled nothing ever .,"['the icing', 'the cake tiramisu', 'cake tiramisu']",but the icing on the cake tiramisu resembled nothing ever .
1549,great food price reasonable .,"['great food price', 'great price', 'food price']",great food price reasonable .
1550,wine list is not huge but def well selected .,['wine list'],wine list is not huge but def well selected .
1551,"cool bar great food , ton of excellent beer .","['cool bar great food', 'excellent beer', 'great food', 'cool food']","cool bar great food , ton of excellent beer ."
1552,"be sure to try seasonal , always delicious , special .",[],"be sure to try seasonal , always delicious , special ."
1553,ambience is authentic relaxing we always received attentive prompt service .,"['attentive service', 'prompt service', 'authentic relaxing', 'attentive prompt service']",ambience is authentic relaxing we always received attentive prompt service .
1554,"fresh , authentic , french cuisine in substantial portion .","['fresh cuisine', 'authentic cuisine', 'french cuisine', 'substantial portion']","fresh , authentic , french cuisine in substantial portion ."
1555,"drink got screwed up , acted put upon .",[],"drink got screwed up , acted put upon ."
1556,one vegetarian entree abby treasure actually quite surprise it delicious and wintermelon covering an assortment of fresh mushroom and vegetable .,"['abby treasure', 'fresh mushroom', 'vegetarian treasure', 'an assortment']",one vegetarian entree abby treasure actually quite surprise it delicious and wintermelon covering an assortment of fresh mushroom and vegetable .
1557,"at dumpling , not go wrong .",[],"at dumpling , not go wrong ."
1558,but pizza is way to expensive .,[],but pizza is way to expensive .
1559,"staff is also young , energeic hot ! !",[],"staff is also young , energeic hot ! !"
1560,"even better , know to cook french classic like steak au poivre onglet without burning it to death or overcooking it .",['french classic'],"even better , know to cook french classic like steak au poivre onglet without burning it to death or overcooking it ."
1561,"service decent , but not a smooth a would expect price reputation .",['price reputation'],"service decent , but not a smooth a would expect price reputation ."
1562,we wonderful meal at naples month ago on visit to nyc .,['wonderful meal'],we wonderful meal at naples month ago on visit to nyc .
1563,good drink .,['good drink'],good drink .
1564,"great food spinach and corn dumpling and massamman curry , friendly and no nonsense service and clean and funky bathroom .","['clean and funky bathroom', 'no nonsense service', 'corn dumpling', 'clean bathroom', 'nonsense service', 'great spinach', 'friendly curry', 'great food spinach', 'food spinach']","great food spinach and corn dumpling and massamman curry , friendly and no nonsense service and clean and funky bathroom ."
1565,friday night .,['friday night'],friday night .
1566,we girl night dinner week .,['dinner week'],we girl night dinner week .
1567,romantic if want it to be brightly lit .,[],romantic if want it to be brightly lit .
1568,"however , work dinner not long ago my colleague london noticed large waterbug on ceiling .","['work dinner', 'large waterbug', 'my colleague']","however , work dinner not long ago my colleague london noticed large waterbug on ceiling ."
1569,recommend it !,[],recommend it !
1570,taken practically every guest come to visit me in ny hooked new yorkers onto peep a well .,"['new yorkers', 'practically every guest']",taken practically every guest come to visit me in ny hooked new yorkers onto peep a well .
1571,enough said !,[],enough said !
1572,live in ny but my best friend .,"['my best friend', 'best friend']",live in ny but my best friend .
1573,my chow fun and chow see really bland and oily .,"['my chow fun', 'chow fun']",my chow fun and chow see really bland and oily .
1574,"even though made reservation at pm night dinnerbroker , we seated at table one of best view !","['pm night dinnerbroker', 'night dinnerbroker', 'best view', 'pm night']","even though made reservation at pm night dinnerbroker , we seated at table one of best view !"
1575,"we notice however , table looked like pita instead of naan .",[],"we notice however , table looked like pita instead of naan ."
1576,"take look at rest menu , but oyster fantastic .","['oyster fantastic', 'rest menu']","take look at rest menu , but oyster fantastic ."
1577,review treked brooklyn .,[],review treked brooklyn .
1578,grilled cheese at home afterwards better. ! !,['grilled cheese'],grilled cheese at home afterwards better. ! !
1579,we pleasantly greeted .,[],we pleasantly greeted .
1580,red sliding door may be unique but do not block cold air outside .,"['red sliding door', 'sliding door', 'cold air']",red sliding door may be unique but do not block cold air outside .
1581,"great service , great food .","['great service', 'great food']","great service , great food ."
1582,"food is expensive , but worth every bite .",[],"food is expensive , but worth every bite ."
1583,"sometimes get bad food bad service , sometimes get good good bad service .","['good service', 'bad service', 'bad food bad service', 'good good bad service']","sometimes get bad food bad service , sometimes get good good bad service ."
1584,we finally seated waitress came by twice order check .,"['order check', 'twice order check']",we finally seated waitress came by twice order check .
1585,in summer eat outside on terrace another great feature of suan ! !,"['another great feature', 'great feature']",in summer eat outside on terrace another great feature of suan ! !
1586,"it perfect ny life style , it got cool design , awsome drink food lot of good looking people eating hanging at pink bar ...","['ny life style', 'awsome drink food lot', 'ny life', 'pink bar', 'good looking people', 'awsome drink', 'drink food', 'looking people', 'food lot', 'life style', 'cool design']","it perfect ny life style , it got cool design , awsome drink food lot of good looking people eating hanging at pink bar ..."
1587,"recommendation , of course , required !",[],"recommendation , of course , required !"
1588,we to wait at bar approx .,['bar approx'],we to wait at bar approx .
1589,fella say best taiwanese in town .,[],fella say best taiwanese in town .
1590,"yeah , it good .","['yeah , it']","yeah , it good ."
1591,"if love seafood , would love place !",['love seafood'],"if love seafood , would love place !"
1592,"good , fast service .","['fast service', 'good service', 'good , fast service']","good , fast service ."
1593,dakshin is one of affordable tasty indian in upper east side .,"['affordable indian', 'upper east side', 'east side', 'affordable tasty indian', 'tasty indian', 'upper side']",dakshin is one of affordable tasty indian in upper east side .
1594,charge different price time .,"['price time', 'different time', 'different price time']",charge different price time .
1595,"to at thalia be slightly deceiving beautiful on outside , so bland on inside .",[],"to at thalia be slightly deceiving beautiful on outside , so bland on inside ."
1596,"in love pongsri on th , but compared to suan it is slow in service overpriced .",['love pongsri'],"in love pongsri on th , but compared to suan it is slow in service overpriced ."
1597,"my friend experienced amazing cheese delicious , new summer menu at artisanal last night .","['new summer menu', 'amazing cheese', 'my friend', 'artisanal night', 'artisanal last night', 'new menu', 'summer menu', 'last night']","my friend experienced amazing cheese delicious , new summer menu at artisanal last night ."
1598,"am so coming back , a much a .",[],"am so coming back , a much a ."
1599,going back .,[],going back .
1600,"it charmingly small lead to an atmoshere is extremely cozy romantic , even .","['small lead', 'an atmoshere']","it charmingly small lead to an atmoshere is extremely cozy romantic , even ."
1601,it is obvious no one in idea or experience japanese cuisine .,"['japanese cuisine', 'no one']",it is obvious no one in idea or experience japanese cuisine .
1602,"in term of food nothing special , we limited to several appetizer .",['several appetizer'],"in term of food nothing special , we limited to several appetizer ."
1603,love jazz band on fri sat .,"['love jazz band', 'jazz band', 'love jazz']",love jazz band on fri sat .
1604,"overall , excellent !",[],"overall , excellent !"
1605,"to begin , we told minute wait started to leave , hostess offered to call u on cell phone table ready .","['cell phone table', 'phone table', 'cell phone', 'minute wait']","to begin , we told minute wait started to leave , hostess offered to call u on cell phone table ready ."
1606,server give sample slice of order wait shortly might add .,['sample slice'],server give sample slice of order wait shortly might add .
1607,service ok .,['ok service'],service ok .
1608,"asked certain dish prepared in comparison to similar at thai restaurant , he replied is not mcdonald , every make thing differently it is understandable every is indeed different , not need to be uncourteous to customer downright rude .","['similar comparison', 'customer downright rude', 'thai restaurant', 'certain dish', 'customer rude']","asked certain dish prepared in comparison to similar at thai restaurant , he replied is not mcdonald , every make thing differently it is understandable every is indeed different , not need to be uncourteous to customer downright rude ."
1609,ate first time absolutely loved it !,['first time'],ate first time absolutely loved it !
1610,"expect to sit inside though , table always full .",['full table'],"expect to sit inside though , table always full ."
1611,"staff is accomodating , ambiance is exciting yet relaxed , food is of world !",[],"staff is accomodating , ambiance is exciting yet relaxed , food is of world !"
1612,"food delicious halibut special , my husband steak , service top notch .","['halibut special', 'husband steak', 'service top notch', 'top notch', 'delicious special']","food delicious halibut special , my husband steak , service top notch ."
1613,manager claimed he could not compensate u anything on bill show lack of sophistication entire group .,"['sophistication entire group', 'entire group']",manager claimed he could not compensate u anything on bill show lack of sophistication entire group .
1614,is by far my favorite in neighborhood .,['my favorite'],is by far my favorite in neighborhood .
1615,but far east !,['but far east'],but far east !
1616,satisfying .,[],satisfying .
1617,highly highly highly recommended !,[],highly highly highly recommended !
1618,it get yummy authentic japanese comfort food .,"['comfort food', 'yummy food', 'japanese food', 'authentic food']",it get yummy authentic japanese comfort food .
1619,we took advanatage of half price sushi deal on saturday so it well worth it .,"['price sushi', 'half price sushi deal', 'sushi deal', 'half deal']",we took advanatage of half price sushi deal on saturday so it well worth it .
1620,we came on crowded saturday night seated right away despite minute late reservation .,"['minute reservation', 'saturday night', 'late reservation', 'crowded night', 'minute late reservation']",we came on crowded saturday night seated right away despite minute late reservation .
1621,"is cool enough to be in east village , but french enough to make feel like could be in bistro in back alley in paris .","['back alley', 'east village']","is cool enough to be in east village , but french enough to make feel like could be in bistro in back alley in paris ."
1622,we fast to order appetizer platter since we hungry .,['appetizer platter'],we fast to order appetizer platter since we hungry .
1623,"staff attentive , smile on face .",['staff attentive'],"staff attentive , smile on face ."
1624,is best shabu shabu in try state area .,"['state area', 'shabu shabu', 'best shabu shabu', 'best shabu']",is best shabu shabu in try state area .
1625,"no dress code , no attitude , plenty of comfort companionship , great place to relax in an always busy midtown .","['dress code', 'no dress code', 'great place', 'an always busy midtown', 'no attitude', 'busy midtown', 'comfort companionship']","no dress code , no attitude , plenty of comfort companionship , great place to relax in an always busy midtown ."
1626,"largest freshest piece of sushi , delicious !","['largest freshest piece', 'freshest piece', 'delicious piece', 'largest piece']","largest freshest piece of sushi , delicious !"
1627,even pasta is delicious rarity in new york pizza restaurant .,"['york restaurant', 'new york pizza restaurant', 'delicious rarity', 'even pasta', 'pizza restaurant']",even pasta is delicious rarity in new york pizza restaurant .
1628,"but we looked at menu , lot of choice , of dumpling in appetizer section .",['appetizer section'],"but we looked at menu , lot of choice , of dumpling in appetizer section ."
1629,"maybe say so it looked promising people like artery clogging jewish deli food , but turn to be poorly run awful .","['deli food', 'clogging food', 'jewish deli']","maybe say so it looked promising people like artery clogging jewish deli food , but turn to be poorly run awful ."
1630,my rd time manager remembered me treated me like an usual customer .,"['time manager', 'an usual customer', 'rd time', 'usual customer', 'my rd time manager']",my rd time manager remembered me treated me like an usual customer .
1631,is greatly welcome in desolate little strip prospect expressway greenwood cemetery wasteland we like to call sliv .,"['expressway wasteland', 'cemetery wasteland', 'greenwood wasteland']",is greatly welcome in desolate little strip prospect expressway greenwood cemetery wasteland we like to call sliv .
1632,if could get toaster .,[],if could get toaster .
1633,find returning quite often .,[],find returning quite often .
1634,"he not making authentic neapolitan pizza in open brick oven or lightly frying zucchini blossom , he visiting regular growing legion checking on newcomer .","['authentic neapolitan pizza', 'zucchini blossom', 'growing legion', 'regular legion', 'regular growing legion', 'open brick']","he not making authentic neapolitan pizza in open brick oven or lightly frying zucchini blossom , he visiting regular growing legion checking on newcomer ."
1635,wait staff is blantently unappreciative of business but best pie on uws !,"['best pie', 'wait staff']",wait staff is blantently unappreciative of business but best pie on uws !
1636,"ingredient taste fresher , crust is thinner crispier , slice is less oily , it never burnt like it occasionally is at joe .","['thinner crispier', 'taste fresher', 'ingredient taste']","ingredient taste fresher , crust is thinner crispier , slice is less oily , it never burnt like it occasionally is at joe ."
1637,fish is so fresh .,[],fish is so fresh .
1638,price cheap compared to quality of service food .,['service food'],price cheap compared to quality of service food .
1639,go if already in neighborhood want to bother going farther better .,[],go if already in neighborhood want to bother going farther better .
1640,"top in town vietnamese classic , better place cost lot .","['town vietnamese classic', 'better place', 'cost lot', 'vietnamese classic', 'place cost']","top in town vietnamese classic , better place cost lot ."
1641,less wait time me !,[],less wait time me !
1642,"perfect quiet , relaxing , delicious accompaniment to afternoon of theater .","['relaxing accompaniment', 'quiet accompaniment', 'delicious accompaniment', 'perfect accompaniment']","perfect quiet , relaxing , delicious accompaniment to afternoon of theater ."
1643,"decor is really blah , not at hip or happening .",[],"decor is really blah , not at hip or happening ."
1644,"discovered ping on internet , we entered qualm but instantly put to ease by fish tank greet a walk in .","['fish tank', 'a walk']","discovered ping on internet , we entered qualm but instantly put to ease by fish tank greet a walk in ."
1645,not go wrong at red eye grill .,"['eye grill', 'red eye grill', 'red grill']",not go wrong at red eye grill .
1646,it appears to be owner first venture it show .,"['owner first venture', 'first venture', 'owner venture']",it appears to be owner first venture it show .
1647,"come family of pizzeria owner , almost ashamed to say pizza in fornino blow my family receipies away .",['pizzeria owner'],"come family of pizzeria owner , almost ashamed to say pizza in fornino blow my family receipies away ."
1648,go twice month !,[],go twice month !
1649,we ordered beef noodle soup dish thai section of menu but nothing we got thai .,"['thai section', 'noodle soup', 'beef soup']",we ordered beef noodle soup dish thai section of menu but nothing we got thai .
1650,huge selection of different cream cheese of salad great .,"['cream cheese', 'different cheese', 'different cream cheese', 'huge selection']",huge selection of different cream cheese of salad great .
1651,lobster sandwich is good and spaghetti with scallop and shrimp is great .,['lobster sandwich'],lobster sandwich is good and spaghetti with scallop and shrimp is great .
1652,food authentic .,[],food authentic .
1653,dim sum is delectable price quite easy on wallet .,"['dim sum', 'delectable price']",dim sum is delectable price quite easy on wallet .
1654,"tried simple dish of spinach ravioli in light oil and garlic sauce , but it actually faired better nyc italian joint ve tried similar dish at .","['similar dish', 'better nyc italian joint', 'light sauce', 'spinach ravioli', 'italian joint', 'nyc joint', 'better joint', 'simple dish']","tried simple dish of spinach ravioli in light oil and garlic sauce , but it actually faired better nyc italian joint ve tried similar dish at ."
1655,worst excuse japanese food ve ever encountered .,['japanese food'],worst excuse japanese food ve ever encountered .
1656,million better place to go in city .,"['million better place', 'better place']",million better place to go in city .
1657,"if celebrity make sweat , in ride , but if like around part ll yawn wonder whats hype .",[],"if celebrity make sweat , in ride , but if like around part ll yawn wonder whats hype ."
1658,okay mind oily part cause cooked way but it way bland .,"['cooked way', 'okay mind', 'oily part']",okay mind oily part cause cooked way but it way bland .
1659,ordered chicken teriyaki dish found chicken extremely dry .,"['chicken dish', 'teriyaki dish', 'chicken teriyaki dish']",ordered chicken teriyaki dish found chicken extremely dry .
1660,love it .,[],love it .
1661,if want something really different try jekyll hyde .,['jekyll hyde'],if want something really different try jekyll hyde .
1662,"we reservation at pm , but not seated pm .","['seated pm', 'not seated pm']","we reservation at pm , but not seated pm ."
1663,we pam special fried fish it amazing .,"['special fried fish', 'fried fish', 'special fish']",we pam special fried fish it amazing .
1664,located in greenewich village .,['greenewich village'],located in greenewich village .
1665,is no excuse lousy service !,"['lousy service', 'no excuse lousy service']",is no excuse lousy service !
1666,three strike is .,['three strike'],three strike is .
1667,we bring in party of ten or so every week .,[],we bring in party of ten or so every week .
1668,my boyfriend new england chowder it good but think award go to lobster bisque .,"['lobster bisque', 'new england chowder', 'my boyfriend', 'england chowder']",my boyfriend new england chowder it good but think award go to lobster bisque .
1669,"so , little inconsistency but either way , pizza really good .",['little inconsistency'],"so , little inconsistency but either way , pizza really good ."
1670,"overall is expensive sushi favorite , but everything delicious .","['expensive sushi favorite', 'expensive favorite', 'sushi favorite']","overall is expensive sushi favorite , but everything delicious ."
1671,we would return to !,[],we would return to !
1672,not enough wine by the glass either .,"['not enough wine', 'enough wine', 'the glass']",not enough wine by the glass either .
1673,duck breast special on my last visit it incredible .,"['last visit', 'duck breast', 'my last visit', 'special breast']",duck breast special on my last visit it incredible .
1674,must say it little pricey food it not a spectacular a view .,"['spectacular view', 'little food', 'pricey food', 'little pricey food']",must say it little pricey food it not a spectacular a view .
